[janson@localhost koolnet]$ ./ctest -user="janson2" -password="janson"
2015/12/20 13:45:33 Got clientId: 21
2015/12/20 13:45:33 resetLocalAddrs: [192.168.1.23:35304 172.17.42.1:35304]
2015/12/20 13:45:33 starting
2015/12/20 13:45:33 resetLocalAddrs: [192.168.1.23:35304 172.17.42.1:35304 183.16.171.56:35304]
2015/12/20 13:45:33 Request from outself
2015/12/20 13:45:33 got from myself [192.168.1.23:35304 172.17.42.1:35304] []
2015/12/20 13:45:33 ips [192.168.1.8:35304 223.73.106.138:35304]
2015/12/20 13:45:33 shakeOne To 192.168.1.8:58593
2015/12/20 13:45:33 shakeOne To 223.73.106.138:35669
2015/12/20 13:45:33 shakeOne To 192.168.1.8:58593
2015/12/20 13:45:33 shakeOne To 223.73.106.138:35669
2015/12/20 13:45:33 shakeOne To 192.168.1.8:58593
2015/12/20 13:45:33 shakeOne To 223.73.106.138:35669
2015/12/20 13:45:33 Notify remote for shaking
2015/12/20 13:45:53 shakeOne To 192.168.1.8:58593
2015/12/20 13:45:53 shakeOne To 223.73.106.138:35669
2015/12/20 13:45:53 shakeOne To 192.168.1.8:58593
2015/12/20 13:45:53 shakeOne To 223.73.106.138:35669
2015/12/20 13:45:53 shakeOne To 192.168.1.8:58593
2015/12/20 13:45:53 shakeOne To 223.73.106.138:35669
2015/12/20 13:46:02 tcpReadLoop error:  message: readMessageError

13:45:23.587309 IP 183.16.171.56.60953 > 58.220.12.40.8000: UDP, length 53
13:45:23.614703 IP 58.220.12.40.8000 > 183.16.171.56.60953: UDP, length 36
13:45:24.117203 IP 183.16.171.56.43219 > public1.alidns.com.domain: 25025+ PTR? 40.12.220.58.in-addr.arpa. (43)
13:45:24.570134 IP 183.16.171.56.ntp > 202.118.1.130.ntp: NTPv4, Client, length 48
13:45:24.622400 IP public1.alidns.com.domain > 183.16.171.56.43219: 25025 NXDomain 0/1/0 (99)
13:45:24.698335 IP 202.118.1.130.ntp > 183.16.171.56.ntp: NTPv3, Server, length 48
13:45:25.573380 IP 183.16.171.56.50929 > 10.120.156.200.snmp:  GetRequest(63)  25.3.2.1.5.1 25.3.5.1.1.1 25.3.5.1.2.1
13:45:25.573624 IP 183.16.171.56.50929 > 10.120.156.200.snmp:  GetRequest(63)  25.3.2.1.5.1 25.3.5.1.1.1 25.3.5.1.2.1
13:45:28.088671 IP 183.60.56.20.8000 > 183.16.171.56.60690: UDP, length 223
13:45:28.090118 IP 183.16.171.56.60690 > 183.60.56.20.8000: UDP, length 55
13:45:28.873186 IP 183.60.56.20.8000 > 183.16.171.56.60690: UDP, length 79
13:45:29.614643 IP 183.60.56.20.8000 > 183.16.171.56.60690: UDP, length 279
13:45:29.616147 IP 183.16.171.56.60690 > 183.60.56.20.8000: UDP, length 55
13:45:29.617849 IP 183.60.56.20.8000 > 183.16.171.56.60690: UDP, length 279
13:45:29.618703 IP 183.16.171.56.60690 > 183.60.56.20.8000: UDP, length 55
13:45:29.628663 IP 183.60.56.20.8000 > 183.16.171.56.60690: UDP, length 279
13:45:29.629471 IP 183.16.171.56.60690 > 183.60.56.20.8000: UDP, length 55
13:45:30.021446 IP 183.60.56.20.8000 > 183.16.171.56.60690: UDP, length 127
13:45:30.023094 IP 183.16.171.56.60690 > 183.60.56.20.8000: UDP, length 55
13:45:32.890392 IP 183.60.56.20.8000 > 183.16.171.56.60690: UDP, length 79
13:45:33.501645 IP 183.16.171.56.35304 > 115.28.237.155.18886: UDP, length 107
13:45:33.657594 IP 183.16.171.56.35304 > 223.73.106.138.35669: UDP, length 65
13:45:33.667735 IP 183.16.171.56.35304 > 223.73.106.138.35669: UDP, length 65
13:45:33.677920 IP 183.16.171.56.35304 > 223.73.106.138.35669: UDP, length 65
13:45:33.758160 IP 14.215.80.90.35669 > 183.16.171.56.35304: UDP, length 64
13:45:33.764668 IP 14.215.80.90.35669 > 183.16.171.56.35669: UDP, length 64
13:45:33.778374 IP 14.215.80.90.35669 > 183.16.171.56.35304: UDP, length 64
13:45:33.786368 IP 14.215.80.90.35669 > 183.16.171.56.35669: UDP, length 64
13:45:33.801945 IP 14.215.80.90.35669 > 183.16.171.56.35304: UDP, length 64
13:45:33.806026 IP 14.215.80.90.35669 > 183.16.171.56.35669: UDP, length 64
13:45:34.095616 IP 183.16.171.56.53737 > public1.alidns.com.domain: 6828+ PTR? 155.237.28.115.in-addr.arpa. (45)
13:45:34.591889 IP public1.alidns.com.domain > 183.16.171.56.53737: 6828 NXDomain 0/0/0 (45)
13:45:34.592415 IP 183.16.171.56.39703 > public1.alidns.com.domain: 37155+ PTR? 138.106.73.223.in-addr.arpa. (45)
13:45:34.737674 IP 183.60.56.20.8000 > 183.16.171.56.60690: UDP, length 79
13:45:35.584241 IP 183.60.56.20.8000 > 183.16.171.56.60690: UDP, length 223
13:45:35.585451 IP 183.16.171.56.60690 > 183.60.56.20.8000: UDP, length 55
13:45:35.607536 IP 183.60.56.20.8000 > 183.16.171.56.60690: UDP, length 79
13:45:35.950008 IP 183.60.56.20.8000 > 183.16.171.56.60690: UDP, length 79
13:45:38.953672 IP 183.16.171.56.3027 > 183.60.209.80.8000: UDP, length 39
13:45:38.959115 IP 183.60.209.80.8000 > 183.16.171.56.3027: UDP, length 25
13:45:39.217939 IP 183.60.56.20.8000 > 183.16.171.56.60690: UDP, length 79
13:45:39.597417 IP 183.16.171.56.42900 > public1.alidns.com.domain: 46786+ PTR? 138.106.73.223.in-addr.arpa. (45)
13:45:39.659304 IP 183.60.56.20.8000 > 183.16.171.56.60690: UDP, length 79
13:45:40.742849 IP 183.16.171.56.60690 > 183.60.56.20.8000: UDP, length 47
13:45:40.751363 IP 183.60.56.20.8000 > 183.16.171.56.60690: UDP, length 39
13:45:41.040189 IP 183.16.171.56.45646 > 183.60.209.36.80: UDP, length 172
13:45:41.046975 IP 183.60.209.36.80 > 183.16.171.56.45646: UDP, length 28
13:45:49.614912 IP 183.16.171.56.59740 > public1.alidns.com.domain: 34660+ PTR? 36.209.60.183.in-addr.arpa. (44)
13:45:49.624086 IP public1.alidns.com.domain > 183.16.171.56.59740: 34660 NXDomain 0/1/0 (104)
13:45:50.225063 IP 183.16.171.56.52672 > public1.alidns.com.domain: 8816+ A? tracker.openbittorrent.com. (44)
13:45:50.225126 IP 183.16.171.56.19992 > public1.alidns.com.domain: 43926+ AAAA? tracker.openbittorrent.com. (44)
13:45:50.231949 IP public1.alidns.com.domain > 183.16.171.56.19992: 43926 0/1/0 (98)
13:45:50.232425 IP public1.alidns.com.domain > 183.16.171.56.52672: 8816 1/0/0 A 141.255.161.22 (60)
13:45:51.950413 IP 183.60.56.20.8000 > 183.16.171.56.60690: UDP, length 79
13:45:52.032994 IP 183.60.56.20.8000 > 183.16.171.56.60690: UDP, length 79
13:45:53.501122 IP 183.16.171.56.35304 > 115.28.237.155.18886: UDP, length 129
13:45:53.501383 IP 183.16.171.56.35304 > 223.73.106.138.35669: UDP, length 65
13:45:53.511613 IP 183.16.171.56.35304 > 223.73.106.138.35669: UDP, length 65
13:45:53.512681 IP 183.16.171.56.60690 > 183.60.56.20.8000: UDP, length 39
13:45:53.514989 IP 183.60.56.20.8000 > 183.16.171.56.60690: UDP, length 47
13:45:53.521820 IP 183.16.171.56.35304 > 223.73.106.138.35669: UDP, length 65
13:45:53.560016 IP 14.215.80.90.35669 > 183.16.171.56.35304: UDP, length 104
13:45:53.572527 IP 14.215.80.90.35669 > 183.16.171.56.35304: UDP, length 104
13:45:53.584680 IP 42.81.66.202.35669 > 183.16.171.56.35304: UDP, length 104
13:45:53.592398 IP 42.81.66.202.35669 > 183.16.171.56.35304: UDP, length 104
13:45:53.622724 IP 14.215.80.90.35669 > 183.16.171.56.35304: UDP, length 64
13:45:53.623212 IP 183.16.171.56.35372 > public1.alidns.com.domain: 9349+ PTR? 202.66.81.42.in-addr.arpa. (43)
13:45:53.632803 IP public1.alidns.com.domain > 183.16.171.56.35372: 9349 NXDomain 0/1/0 (132)
13:45:53.644001 IP 14.215.80.90.35669 > 183.16.171.56.35304: UDP, length 64
13:45:53.650201 IP 14.215.80.90.35669 > 183.16.171.56.35669: UDP, length 64
13:45:53.658760 IP 14.215.80.90.35669 > 183.16.171.56.35669: UDP, length 64
13:45:53.659107 IP 42.81.66.202.35669 > 183.16.171.56.35669: UDP, length 64
13:45:53.664010 IP 14.215.80.90.35669 > 183.16.171.56.35304: UDP, length 64
13:45:53.669205 IP 14.215.80.90.35669 > 183.16.171.56.35669: UDP, length 64
13:45:53.681092 IP 42.81.66.202.35669 > 183.16.171.56.35669: UDP, length 64
13:45:54.770810 IP 183.60.56.20.8000 > 183.16.171.56.60690: UDP, length 247
13:45:54.773984 IP 183.16.171.56.60690 > 183.60.56.20.8000: UDP, length 55
13:45:55.302728 IP 183.60.56.20.8000 > 183.16.171.56.60690: UDP, length 79
13:45:58.128971 IP 183.60.56.20.8000 > 183.16.171.56.60690: UDP, length 79
13:45:58.742679 IP 183.16.171.56.60690 > 183.60.56.20.8000: UDP, length 95
13:45:58.807378 IP 183.60.56.20.8000 > 183.16.171.56.60690: UDP, length 135
