2015/12/20 19:14:06 resetLocalAddrs: [192.168.1.8:57222 223.73.106.138:57222 223
.73.106.138:35674]
2015/12/20 19:14:06 got from themself [192.168.1.23:46182 172.17.42.1:46182 183.
16.171.56:46182 183.16.171.56:46182] [192.168.1.8:57222 223.73.106.138:57222 223
.73.106.138:35674]
2015/12/20 19:14:06 shakeOne To 192.168.1.23:46182
2015/12/20 19:14:06 shakeOne To 172.17.42.1:46182
2015/12/20 19:14:06 shakeOne To 183.16.171.56:46182
2015/12/20 19:14:06 shakeOne To 183.16.171.56:46182
2015/12/20 19:14:06 shakeOne To 192.168.1.23:46182
2015/12/20 19:14:06 shakeOne To 172.17.42.1:46182
2015/12/20 19:14:06 shakeOne To 183.16.171.56:46182
2015/12/20 19:14:06 shakeOne To 183.16.171.56:46182
2015/12/20 19:14:06 shakeOne To 192.168.1.23:46182
2015/12/20 19:14:06 shakeOne To 172.17.42.1:46182
2015/12/20 19:14:06 shakeOne To 183.16.171.56:46182
2015/12/20 19:14:06 shakeOne To 183.16.171.56:46182
2015/12/20 19:14:06 Response notify remote for shake 0
2015/12/20 19:14:06 Got n= 65 from 183.16.171.56:46182
2015/12/20 19:14:06 handleShakeingMsg sid 223.73.106.138:35674;183.16.171.56:461
82
2015/12/20 19:14:06 shakeOne To 183.16.171.56:46182
2015/12/20 19:14:06 Got n= 65 from 183.16.171.56:46182
2015/12/20 19:14:06 handleShakeingMsg sid 223.73.106.138:35674;183.16.171.56:461
82
2015/12/20 19:14:06 shakeOne To 183.16.171.56:46182
2015/12/20 19:14:06 Got n= 65 from 183.16.171.56:46182
2015/12/20 19:14:06 handleShakeingMsg sid 223.73.106.138:35674;183.16.171.56:461
82
2015/12/20 19:14:06 shakeOne To 183.16.171.56:46182
2015/12/20 19:14:11 Got n= 65 from 183.16.171.56:46182
2015/12/20 19:14:11 handleShakeingMsg sid 223.73.106.138:35674;183.16.171.56:461
82
2015/12/20 19:14:11 shakeOne To 183.16.171.56:46182
2015/12/20 19:14:11 Got n= 65 from 183.16.171.56:46182
2015/12/20 19:14:11 handleShakeingMsg sid 223.73.106.138:35674;183.16.171.56:461
82
2015/12/20 19:14:11 shakeOne To 183.16.171.56:46182
2015/12/20 19:14:11 Got n= 65 from 183.16.171.56:46182
2015/12/20 19:14:11 handleShakeingMsg sid 223.73.106.138:35674;183.16.171.56:461
82


[janson@localhost koolnet]$ ./ctest -user="janson2" -password="janson"
2015/12/20 19:14:04 Got clientId: 41 IP 183.16.171.56
2015/12/20 19:14:04 starting
2015/12/20 19:14:05 init pong 183.16.171.56:46182
2015/12/20 19:14:05 resetLocalAddrs: [192.168.1.23:46182 172.17.42.1:46182 183.16.171.56:46182 183.16.171.56:46182]
2015/12/20 19:14:05 Request from myself
2015/12/20 19:14:05 resetLocalAddrs: [192.168.1.23:46182 172.17.42.1:46182 183.16.171.56:46182 183.16.171.56:46182]
2015/12/20 19:14:05 got from myself [192.168.1.23:46182 172.17.42.1:46182 183.16.171.56:46182 183.16.171.56:46182] [192.168.1.8:57222 223.73.106.138:57222 223.73.106.138:35674]
2015/12/20 19:14:05 shakeOne To 192.168.1.8:57222
2015/12/20 19:14:05 shakeOne To 223.73.106.138:57222
2015/12/20 19:14:05 shakeOne To 223.73.106.138:35674
2015/12/20 19:14:05 shakeOne To 192.168.1.8:57222
2015/12/20 19:14:05 shakeOne To 223.73.106.138:57222
2015/12/20 19:14:05 shakeOne To 223.73.106.138:35674
2015/12/20 19:14:05 shakeOne To 192.168.1.8:57222
2015/12/20 19:14:05 shakeOne To 223.73.106.138:57222
2015/12/20 19:14:05 shakeOne To 223.73.106.138:35674
2015/12/20 19:14:05 Notify remote for shaking 41 [192.168.1.23:46182 172.17.42.1:46182 183.16.171.56:46182 183.16.171.56:46182]
2015/12/20 19:14:05 shakeOne To 192.168.1.8:57222
2015/12/20 19:14:05 shakeOne To 223.73.106.138:57222
2015/12/20 19:14:05 shakeOne To 223.73.106.138:35674
2015/12/20 19:14:05 shakeOne To 192.168.1.8:57222
2015/12/20 19:14:05 shakeOne To 223.73.106.138:57222
2015/12/20 19:14:05 shakeOne To 223.73.106.138:35674
2015/12/20 19:14:05 shakeOne To 192.168.1.8:57222
2015/12/20 19:14:05 shakeOne To 223.73.106.138:57222
2015/12/20 19:14:05 shakeOne To 223.73.106.138:35674
2015/12/20 19:14:05 Response notify remote for shake 41
2015/12/20 19:14:09 shakeOne To 192.168.1.8:57222
2015/12/20 19:14:09 shakeOne To 223.73.106.138:57222
2015/12/20 19:14:09 shakeOne To 223.73.106.138:35674
2015/12/20 19:14:09 shakeOne To 192.168.1.8:57222
2015/12/20 19:14:09 shakeOne To 223.73.106.138:57222
2015/12/20 19:14:09 shakeOne To 223.73.106.138:35674
2015/12/20 19:14:09 shakeOne To 192.168.1.8:57222
2015/12/20 19:14:09 shakeOne To 223.73.106.138:57222
2015/12/20 19:14:09 shakeOne To 223.73.106.138:35674
2015/12/20 19:14:14 shakeOne To 192.168.1.8:57222
2015/12/20 19:14:14 shakeOne To 223.73.106.138:57222
2015/12/20 19:14:14 shakeOne To 223.73.106.138:35674
2015/12/20 19:14:14 shakeOne To 192.168.1.8:57222
2015/12/20 19:14:14 shakeOne To 223.73.106.138:57222
2015/12/20 19:14:14 shakeOne To 223.73.106.138:35674
2015/12/20 19:14:14 shakeOne To 192.168.1.8:57222
2015/12/20 19:14:14 shakeOne To 223.73.106.138:57222
2015/12/20 19:14:14 shakeOne To 223.73.106.138:35674
2015/12/20 19:14:19 shakeOne To 192.168.1.8:57222
2015/12/20 19:14:19 shakeOne To 223.73.106.138:57222
2015/12/20 19:14:19 shakeOne To 223.73.106.138:35674
2015/12/20 19:14:19 shakeOne To 192.168.1.8:57222
2015/12/20 19:14:19 shakeOne To 223.73.106.138:57222
2015/12/20 19:14:19 shakeOne To 223.73.106.138:35674
2015/12/20 19:14:19 shakeOne To 192.168.1.8:57222
2015/12/20 19:14:19 shakeOne To 223.73.106.138:57222
2015/12/20 19:14:19 shakeOne To 223.73.106.138:35674
2015/12/20 19:14:24 shakeOne To 192.168.1.8:57222
2015/12/20 19:14:24 shakeOne To 223.73.106.138:57222
2015/12/20 19:14:24 shakeOne To 223.73.106.138:35674
2015/12/20 19:14:24 shakeOne To 192.168.1.8:57222
2015/12/20 19:14:24 shakeOne To 223.73.106.138:57222
2015/12/20 19:14:24 shakeOne To 223.73.106.138:35674
2015/12/20 19:14:24 shakeOne To 192.168.1.8:57222
2015/12/20 19:14:24 shakeOne To 223.73.106.138:57222
2015/12/20 19:14:24 shakeOne To 223.73.106.138:35674
2015/12/20 19:14:30 tcpReadLoop error:  message: readMessageError
2015/12/20 19:14:30 waiting for 5s for reconnect




listening on br-lan, link-type EN10MB (Ethernet), capture size 65535 bytes
19:13:53.079891 IP 183.60.56.20.8000 > 88u.lan.60690: UDP, length 399
19:13:53.081680 IP 88u.lan.60690 > 183.60.56.20.8000: UDP, length 55
19:13:53.350263 IP 183.60.56.20.8000 > 88u.lan.60690: UDP, length 335
19:13:53.351792 IP 88u.lan.60690 > 183.60.56.20.8000: UDP, length 55
19:13:54.073085 IP 88u.lan.60953 > 58.220.12.40.8000: UDP, length 53
19:13:54.102923 IP 58.220.12.40.8000 > 88u.lan.60953: UDP, length 36
19:13:55.111843 IP 183.60.56.20.8000 > 88u.lan.60690: UDP, length 79
19:13:55.724198 IP pmm-pc.lan.50929 > 10.120.156.200.snmp:  GetRequest(26)  system.sysDescr.0
19:13:56.724268 IP pmm-pc.lan.50929 > 10.120.156.200.snmp:  GetRequest(26)  system.sysDescr.0
19:13:56.925325 IP 183.60.56.20.8000 > 88u.lan.60690: UDP, length 255
19:13:56.927025 IP 88u.lan.60690 > 183.60.56.20.8000: UDP, length 55
19:13:58.824291 IP nas.lan.42784 > 192.168.90.255.65001: UDP, length 20
19:13:59.028545 IP nas.lan.42784 > 192.168.90.255.65001: UDP, length 20
19:14:00.359203 IP 183.60.56.20.8000 > 88u.lan.60690: UDP, length 295
19:14:00.360708 IP 88u.lan.60690 > 183.60.56.20.8000: UDP, length 55
19:14:00.640654 IP 183.60.56.20.8000 > 88u.lan.60690: UDP, length 255
19:14:00.642159 IP 88u.lan.60690 > 183.60.56.20.8000: UDP, length 55
19:14:01.797021 IP 88u.lan.60690 > 183.60.56.20.8000: UDP, length 87
19:14:01.801226 IP 183.60.56.20.8000 > 88u.lan.60690: UDP, length 47
19:14:04.669727 IP 88u.lan.4250 > OpenWrt.lan.domain: 33047+ AAAA? ngrok.wang. (28)
19:14:04.678353 IP OpenWrt.lan.domain > 88u.lan.4250: 33047 0/1/0 (91)
19:14:04.913834 IP 88u.lan.44476 > OpenWrt.lan.domain: 59015+ AAAA? ngrok.wang. (28)
19:14:04.913908 IP OpenWrt.lan.domain > 88u.lan.44476: 59015 0/0/0 (28)
19:14:04.917618 IP 88u.lan.46182 > 115.28.237.155.18886: UDP, length 19
19:14:05.024429 IP 115.28.237.155.18886 > 88u.lan.46182: UDP, length 38

19:14:05.208571 IP 88u.lan.46182 > 223.73.106.138.57222: UDP, length 65
19:14:05.208600 IP 88u.lan.46182 > 223.73.106.138.35674: UDP, length 65
19:14:05.218669 IP 88u.lan.46182 > 223.73.106.138.57222: UDP, length 65
19:14:05.218688 IP 88u.lan.46182 > 223.73.106.138.35674: UDP, length 65
19:14:05.228851 IP 88u.lan.46182 > 223.73.106.138.57222: UDP, length 65
19:14:05.228866 IP 88u.lan.46182 > 223.73.106.138.35674: UDP, length 65
19:14:05.260056 IP 183.60.56.20.8000 > 88u.lan.60690: UDP, length 79
19:14:05.364085 IP 88u.lan.60690 > 183.60.56.20.8000: UDP, length 47
19:14:05.380401 IP 183.60.56.20.8000 > 88u.lan.60690: UDP, length 39
19:14:05.399184 IP 88u.lan.46182 > 223.73.106.138.57222: UDP, length 65
19:14:05.399199 IP 88u.lan.46182 > 223.73.106.138.35674: UDP, length 65
19:14:05.409476 IP 88u.lan.46182 > 223.73.106.138.57222: UDP, length 65
19:14:05.409493 IP 88u.lan.46182 > 223.73.106.138.35674: UDP, length 65
19:14:05.419747 IP 88u.lan.46182 > 223.73.106.138.57222: UDP, length 65
19:14:05.419761 IP 88u.lan.46182 > 223.73.106.138.35674: UDP, length 65
19:14:05.924398 IP 183.60.56.20.8000 > 88u.lan.60690: UDP, length 79
19:14:06.847926 IP nas.lan.3027 > 183.60.209.80.8000: UDP, length 39
19:14:06.853658 IP 183.60.209.80.8000 > nas.lan.3027: UDP, length 25
19:14:07.459881 IP pmm-pc.lan.50929 > 10.120.156.200.snmp:  GetRequest(63)  25.3.2.1.5.1 25.3.5.1.1.1 25.3.5.1.2.1
19:14:07.460129 IP pmm-pc.lan.50929 > 10.120.156.200.snmp:  GetRequest(63)  25.3.2.1.5.1 25.3.5.1.1.1 25.3.5.1.2.1
19:14:07.798474 IP 183.60.56.20.8000 > 88u.lan.60690: UDP, length 79
19:14:09.917555 IP 88u.lan.46182 > 223.73.106.138.57222: UDP, length 65
19:14:09.917572 IP 88u.lan.46182 > 223.73.106.138.35674: UDP, length 65
19:14:09.927878 IP 88u.lan.46182 > 223.73.106.138.57222: UDP, length 65
19:14:09.927892 IP 88u.lan.46182 > 223.73.106.138.35674: UDP, length 65
19:14:09.938210 IP 88u.lan.46182 > 223.73.106.138.57222: UDP, length 65
19:14:09.938224 IP 88u.lan.46182 > 223.73.106.138.35674: UDP, length 65
19:14:21.387587 IP 183.60.56.20.8000 > 88u.lan.60690: UDP, length 79
19:14:21.866287 IP nas.lan.55902 > 239.255.255.250.1900: UDP, length 129
19:14:21.866415 IP nas.lan.1900 > 239.255.255.250.1900: UDP, length 1024
19:14:21.970189 IP nas.lan.55902 > 239.255.255.250.1900: UDP, length 129
19:14:24.761575 IP 183.60.56.20.8000 > 88u.lan.60690: UDP, length 79
19:14:24.917637 IP 88u.lan.46182 > 223.73.106.138.57222: UDP, length 65
19:14:24.917653 IP 88u.lan.46182 > 223.73.106.138.35674: UDP, length 65
19:14:24.927875 IP 88u.lan.46182 > 223.73.106.138.57222: UDP, length 65
19:14:24.927890 IP 88u.lan.46182 > 223.73.106.138.35674: UDP, length 65
19:14:24.938210 IP 88u.lan.46182 > 223.73.106.138.57222: UDP, length 65
19:14:24.938226 IP 88u.lan.46182 > 223.73.106.138.35674: UDP, length 65
19:14:25.596567 IP 183.60.56.20.8000 > 88u.lan.60690: UDP, length 79
19:14:26.716261 IP 183.60.56.20.8000 > 88u.lan.60690: UDP, length 79
19:14:27.726677 IP pmm-pc.lan.50929 > 10.120.156.200.snmp:  GetRequest(63)  25.3.2.1.5.1 25.3.5.1.1.1 25.3.5.1.2.1
19:14:27.726900 IP pmm-pc.lan.50929 > 10.120.156.200.snmp:  GetRequest(63)  25.3.2.1.5.1 25.3.5.1.1.1 25.3.5.1.2.1
19:14:29.770805 IP 183.60.56.20.8000 > 88u.lan.60690: UDP, length 479
19:14:29.772385 IP 88u.lan.60690 > 183.60.56.20.8000: UDP, length 55
19:14:31.514517 IP 183.60.56.20.8000 > 88u.lan.60690: UDP, length 79
19:14:31.754340 IP 183.60.56.20.8000 > 88u.lan.60690: UDP, length 79
19:14:32.585359 IP 183.60.56.20.8000 > 88u.lan.60690: UDP, length 79
19:14:33.153956 IP 183.60.56.20.8000 > 88u.lan.60690: UDP, length 79
19:14:33.408935 IP nas.lan.57588 > OpenWrt.lan.domain: 36422+ A? nat.emule.org.cn. (34)
19:14:33.420024 IP OpenWrt.lan.domain > nas.lan.57588: 36422 0/1/0 (111)
19:14:33.420292 IP nas.lan.52815 > OpenWrt.lan.domain: 46773+ A? nat.emule.org.cn. (34)
19:14:33.420367 IP OpenWrt.lan.domain > nas.lan.52815: 46773 0/0/0 (34)
