root@OpenWrt:~# tcpdump -i pppoe-wan udp
tcpdump: verbose output suppressed, use -v or -vv for full protocol decode
listening on pppoe-wan, link-type LINUX_SLL (Linux cooked), capture size 65535 bytes
03:04:36.008448 IP server18705.teamviewer.com.5938 > 183.16.154.29.50747: UDP, length 16
03:04:36.446676 IP 183.16.154.29.52745 > public1.alidns.com.domain: 54319+ A? tracker2.itzmx.com. (36)
03:04:36.446741 IP 183.16.154.29.7687 > public1.alidns.com.domain: 54747+ AAAA? tracker2.itzmx.com. (36)
03:04:36.497434 IP 183.16.154.29.50747 > server18705.teamviewer.com.5938: UDP, length 16
03:04:36.553791 IP public1.alidns.com.domain > 183.16.154.29.52745: 54319 1/0/0 A 123.249.16.5 (52)
03:04:36.937627 IP 183.16.154.29.26804 > public1.alidns.com.domain: 6905+ PTR? 148.179.81.119.in-addr.arpa. (45)
03:04:36.949268 IP public1.alidns.com.domain > 183.16.154.29.7687: 54747 0/1/0 (86)
03:04:38.103405 IP 183.16.154.29.51520 > 183.60.209.35.80: UDP, length 172
03:04:38.109662 IP 183.60.209.35.80 > 183.16.154.29.51520: UDP, length 28
03:04:39.118616 IP public1.alidns.com.domain > 183.16.154.29.26804: 6905 1/0/0 PTR server18705.teamviewer.com. (85)
03:04:39.119313 IP 183.16.154.29.62629 > public1.alidns.com.domain: 9248+ PTR? 5.5.5.223.in-addr.arpa. (40)
03:04:39.227936 IP public1.alidns.com.domain > 183.16.154.29.62629: 9248 1/0/0 PTR public1.alidns.com. (72)
03:04:39.228368 IP 183.16.154.29.53067 > public1.alidns.com.domain: 12809+ PTR? 35.209.60.183.in-addr.arpa. (44)
03:04:39.232656 IP public1.alidns.com.domain > 183.16.154.29.53067: 12809 NXDomain 0/1/0 (104)
03:04:40.023995 IP server18705.teamviewer.com.5938 > 183.16.154.29.50747: UDP, length 16
03:04:40.303519 IP 183.16.154.29.56342 > 115.28.237.155.18886: UDP, length 80
03:04:40.356724 IP 49.72.120.239.18887 > 183.16.154.29.56342: UDP, length 118
03:04:40.403533 IP 183.16.154.29.1036 > 49.72.120.239.18887: UDP, length 80
03:04:40.405615 IP 183.16.154.29.38150 > public1.alidns.com.domain: 12338+ A? OpeN.demOnii.Com. (34)
03:04:40.405977 IP 183.16.154.29.48023 > public1.alidns.com.domain: 64144+ AAAA? opEn.demONii.COM. (34)
03:04:40.412724 IP public1.alidns.com.domain > 183.16.154.29.48023: 64144 3/0/0 CNAME demonii.com., AAAA 2400:cb00:2048:1::681b:8389, AAAA 2400:cb00:2048:1::681b:8289 (104)
03:04:40.415200 IP public1.alidns.com.domain > 183.16.154.29.38150: 12338 3/0/0 CNAME demonii.com., A 104.27.131.137, A 104.27.130.137 (80)
03:04:40.571531 IP 171.223.240.65.59947 > 183.16.154.29.49038: UDP, length 64
03:04:40.582250 IP 171.223.240.65.59947 > 183.16.154.29.49038: UDP, length 64
03:04:40.592812 IP 171.223.240.65.59947 > 183.16.154.29.49038: UDP, length 64
03:04:40.639396 IP 183.16.154.29.49038 > 192.168.100.108.59947: UDP, length 66
03:04:40.639583 IP 183.16.154.29.49038 > 192.168.249.1.59947: UDP, length 64
03:04:40.639592 IP 183.16.154.29.49038 > 192.168.198.1.59947: UDP, length 64
03:04:40.639605 IP 183.16.154.29.1036 > 171.223.240.65.59947: UDP, length 65
03:04:40.649595 IP 183.16.154.29.49038 > 192.168.100.108.59947: UDP, length 66
03:04:40.649722 IP 183.16.154.29.49038 > 192.168.198.1.59947: UDP, length 64
03:04:40.649730 IP 183.16.154.29.49038 > 192.168.249.1.59947: UDP, length 64
03:04:40.649743 IP 183.16.154.29.1036 > 171.223.240.65.59947: UDP, length 65
03:04:40.659811 IP 183.16.154.29.49038 > 192.168.100.108.59947: UDP, length 66
03:04:40.659826 IP 183.16.154.29.49038 > 192.168.249.1.59947: UDP, length 64
03:04:40.659948 IP 183.16.154.29.49038 > 192.168.198.1.59947: UDP, length 64
03:04:40.659961 IP 183.16.154.29.1036 > 171.223.240.65.59947: UDP, length 65
03:04:40.752218 IP 171.223.240.65.59947 > 183.16.154.29.49038: UDP, length 64
03:04:40.752581 IP 171.223.240.65.1036 > 183.16.154.29.1036: UDP, length 63
03:04:40.752745 IP 171.223.240.65.1036 > 183.16.154.29.49070: UDP, length 64
03:04:40.763620 IP 171.223.240.65.59947 > 183.16.154.29.49038: UDP, length 64
03:04:40.764294 IP 171.223.240.65.1036 > 183.16.154.29.1036: UDP, length 63
03:04:40.764549 IP 171.223.240.65.1036 > 183.16.154.29.49070: UDP, length 64
03:04:40.774267 IP 171.223.240.65.59947 > 183.16.154.29.49038: UDP, length 64
03:04:40.774279 IP 171.223.240.65.1036 > 183.16.154.29.1036: UDP, length 63
03:04:40.774649 IP 171.223.240.65.1036 > 183.16.154.29.49070: UDP, length 64
03:04:41.025493 IP 183.16.154.29.50414 > public1.alidns.com.domain: 23667+ PTR? 155.237.28.115.in-addr.arpa. (45)
03:04:41.480871 IP 183.16.154.29.50747 > server18705.teamviewer.com.5938: UDP, length 16
03:04:41.532203 IP public1.alidns.com.domain > 183.16.154.29.50414: 23667 NXDomain 0/0/0 (45)
03:04:41.873582 IP 183.16.154.29.58415 > 183.60.56.40.8000: UDP, length 47
03:04:41.879504 IP 183.60.56.40.8000 > 183.16.154.29.58415: UDP, length 39
03:04:44.039534 IP server18705.teamviewer.com.5938 > 183.16.154.29.50747: UDP, length 16
03:04:45.081264 IP 171.223.240.65.59947 > 183.16.154.29.49038: UDP, length 64
03:04:45.081315 IP 171.223.240.65.1036 > 183.16.154.29.1036: UDP, length 63
03:04:45.082342 IP 171.223.240.65.1036 > 183.16.154.29.49070: UDP, length 64
03:04:45.082367 IP 171.223.240.65.1036 > 183.16.154.29.49070: UDP, length 64
03:04:45.082397 IP 171.223.240.65.1036 > 183.16.154.29.1036: UDP, length 63
03:04:45.092354 IP 171.223.240.65.59947 > 183.16.154.29.49038: UDP, length 64
03:04:45.092737 IP 171.223.240.65.1036 > 183.16.154.29.1036: UDP, length 63
03:04:45.092870 IP 171.223.240.65.1036 > 183.16.154.29.49070: UDP, length 64
03:04:45.093152 IP 171.223.240.65.1036 > 183.16.154.29.1036: UDP, length 63
03:04:45.093443 IP 171.223.240.65.1036 > 183.16.154.29.49070: UDP, length 64
03:04:45.104747 IP 171.223.240.65.59947 > 183.16.154.29.49038: UDP, length 64
03:04:45.104856 IP 171.223.240.65.1036 > 183.16.154.29.49070: UDP, length 64
03:04:45.104982 IP 171.223.240.65.1036 > 183.16.154.29.49070: UDP, length 64
03:04:45.104992 IP 171.223.240.65.1036 > 183.16.154.29.1036: UDP, length 63
03:04:45.105001 IP 171.223.240.65.1036 > 183.16.154.29.1036: UDP, length 63
03:04:45.303319 IP 183.16.154.29.49038 > 192.168.100.108.59947: UDP, length 66
03:04:45.303431 IP 183.16.154.29.49038 > 192.168.249.1.59947: UDP, length 64
03:04:45.303440 IP 183.16.154.29.49038 > 192.168.198.1.59947: UDP, length 64
03:04:45.303453 IP 183.16.154.29.1036 > 171.223.240.65.59947: UDP, length 65
03:04:45.303752 IP 183.16.154.29.49038 > 171.223.240.65.1036: UDP, length 64
03:04:45.303761 IP 183.16.154.29.1036 > 171.223.240.65.59979: UDP, length 65
03:04:45.313740 IP 183.16.154.29.49038 > 192.168.100.108.59947: UDP, length 66
03:04:45.313757 IP 183.16.154.29.49038 > 192.168.249.1.59947: UDP, length 64
03:04:45.313897 IP 183.16.154.29.49038 > 192.168.198.1.59947: UDP, length 64
03:04:45.313909 IP 183.16.154.29.1036 > 171.223.240.65.59947: UDP, length 65
03:04:45.313923 IP 183.16.154.29.49038 > 171.223.240.65.1036: UDP, length 64
03:04:45.313999 IP 183.16.154.29.1036 > 171.223.240.65.59979: UDP, length 65
03:04:45.324066 IP 183.16.154.29.49038 > 192.168.100.108.59947: UDP, length 66
03:04:45.324079 IP 183.16.154.29.49038 > 192.168.249.1.59947: UDP, length 64
03:04:45.324219 IP 183.16.154.29.1036 > 171.223.240.65.59979: UDP, length 65
03:04:45.324228 IP 183.16.154.29.49038 > 192.168.198.1.59947: UDP, length 64
03:04:45.324234 IP 183.16.154.29.49038 > 171.223.240.65.1036: UDP, length 64
03:04:45.324241 IP 183.16.154.29.1036 > 171.223.240.65.59947: UDP, length 65
03:04:45.865860 IP 183.16.154.29.58415 > 183.60.56.40.8000: UDP, length 87
03:04:45.880196 IP 183.60.56.40.8000 > 183.16.154.29.58415: UDP, length 87
03:04:46.462570 IP 183.16.154.29.50747 > server18705.teamviewer.com.5938: UDP, length 16
03:04:48.055052 IP server18705.teamviewer.com.5938 > 183.16.154.29.50747: UDP, length 16
03:04:49.786468 IP 183.60.56.40.8000 > 183.16.154.29.58415: UDP, length 79
03:04:50.083581 IP 171.223.240.65.59947 > 183.16.154.29.49038: UDP, length 64
03:04:50.083642 IP 171.223.240.65.1036 > 183.16.154.29.49070: UDP, length 64
03:04:50.083670 IP 171.223.240.65.1036 > 183.16.154.29.1036: UDP, length 63
03:04:50.083700 IP 171.223.240.65.1036 > 183.16.154.29.1036: UDP, length 63
03:04:50.083899 IP 171.223.240.65.1036 > 183.16.154.29.49070: UDP, length 64
03:04:50.095109 IP 171.223.240.65.59947 > 183.16.154.29.49038: UDP, length 64
03:04:50.095416 IP 171.223.240.65.1036 > 183.16.154.29.1036: UDP, length 63
03:04:50.095428 IP 171.223.240.65.1036 > 183.16.154.29.49070: UDP, length 64
03:04:50.095737 IP 171.223.240.65.1036 > 183.16.154.29.1036: UDP, length 63
03:04:50.095748 IP 171.223.240.65.1036 > 183.16.154.29.49070: UDP, length 64
03:04:50.107627 IP 171.223.240.65.59947 > 183.16.154.29.49038: UDP, length 64
03:04:50.107737 IP 171.223.240.65.1036 > 183.16.154.29.1036: UDP, length 63
03:04:50.107941 IP 171.223.240.65.1036 > 183.16.154.29.49070: UDP, length 64
03:04:50.108046 IP 171.223.240.65.1036 > 183.16.154.29.1036: UDP, length 63
03:04:50.108155 IP 171.223.240.65.1036 > 183.16.154.29.49070: UDP, length 64
03:04:50.303269 IP 183.16.154.29.49038 > 192.168.100.108.59947: UDP, length 66
03:04:50.303436 IP 183.16.154.29.49038 > 192.168.249.1.59947: UDP, length 64
03:04:50.303448 IP 183.16.154.29.49038 > 192.168.198.1.59947: UDP, length 64
03:04:50.303455 IP 183.16.154.29.1036 > 171.223.240.65.59947: UDP, length 65
03:04:50.303462 IP 183.16.154.29.1036 > 171.223.240.65.59979: UDP, length 65
03:04:50.303468 IP 183.16.154.29.49038 > 171.223.240.65.1036: UDP, length 64
03:04:50.313540 IP 183.16.154.29.49038 > 192.168.198.1.59947: UDP, length 64
03:04:50.313548 IP 183.16.154.29.49038 > 192.168.100.108.59947: UDP, length 66
03:04:50.313558 IP 183.16.154.29.49038 > 192.168.249.1.59947: UDP, length 64
03:04:50.313730 IP 183.16.154.29.1036 > 171.223.240.65.59979: UDP, length 65
03:04:50.313743 IP 183.16.154.29.1036 > 171.223.240.65.59947: UDP, length 65
03:04:50.313755 IP 183.16.154.29.49038 > 171.223.240.65.1036: UDP, length 64
03:04:50.323885 IP 183.16.154.29.49038 > 192.168.100.108.59947: UDP, length 66
03:04:50.323901 IP 183.16.154.29.49038 > 192.168.249.1.59947: UDP, length 64
03:04:50.323991 IP 183.16.154.29.49038 > 192.168.198.1.59947: UDP, length 64
03:04:50.324003 IP 183.16.154.29.1036 > 171.223.240.65.59947: UDP, length 65
03:04:50.324013 IP 183.16.154.29.49038 > 171.223.240.65.1036: UDP, length 64
03:04:50.324112 IP 183.16.154.29.1036 > 171.223.240.65.59979: UDP, length 65
03:04:51.000849 IP 183.16.154.29.50747 > server18705.teamviewer.com.5938: UDP, length 16
03:04:52.070708 IP server18705.teamviewer.com.5938 > 183.16.154.29.50747: UDP, length 16
03:04:55.081189 IP 171.223.240.65.59947 > 183.16.154.29.49038: UDP, length 64
03:04:55.081401 IP 171.223.240.65.1036 > 183.16.154.29.1036: UDP, length 63
03:04:55.081813 IP 171.223.240.65.1036 > 183.16.154.29.49070: UDP, length 64
03:04:55.082184 IP 171.223.240.65.1036 > 183.16.154.29.1036: UDP, length 63
03:04:55.082287 IP 171.223.240.65.1036 > 183.16.154.29.49070: UDP, length 64
03:04:55.093099 IP 171.223.240.65.59947 > 183.16.154.29.49038: UDP, length 64
03:04:55.093374 IP 171.223.240.65.1036 > 183.16.154.29.1036: UDP, length 63
03:04:55.093621 IP 171.223.240.65.1036 > 183.16.154.29.49070: UDP, length 64
03:04:55.093741 IP 171.223.240.65.1036 > 183.16.154.29.1036: UDP, length 63
03:04:55.093929 IP 171.223.240.65.1036 > 183.16.154.29.49070: UDP, length 64
03:04:55.106368 IP 171.223.240.65.59947 > 183.16.154.29.49038: UDP, length 64
03:04:55.106508 IP 171.223.240.65.1036 > 183.16.154.29.1036: UDP, length 63
03:04:55.106520 IP 171.223.240.65.1036 > 183.16.154.29.49070: UDP, length 64
03:04:55.106631 IP 171.223.240.65.1036 > 183.16.154.29.1036: UDP, length 63
03:04:55.106642 IP 171.223.240.65.1036 > 183.16.154.29.49070: UDP, length 64
03:04:55.303260 IP 183.16.154.29.49038 > 192.168.100.108.59947: UDP, length 66
03:04:55.303381 IP 183.16.154.29.49038 > 192.168.249.1.59947: UDP, length 64
03:04:55.303390 IP 183.16.154.29.49038 > 192.168.198.1.59947: UDP, length 64
03:04:55.303492 IP 183.16.154.29.1036 > 171.223.240.65.59979: UDP, length 65
03:04:55.303500 IP 183.16.154.29.49038 > 171.223.240.65.1036: UDP, length 64
03:04:55.303512 IP 183.16.154.29.1036 > 171.223.240.65.59947: UDP, length 65
03:04:55.313677 IP 183.16.154.29.49038 > 192.168.100.108.59947: UDP, length 66
03:04:55.313693 IP 183.16.154.29.49038 > 192.168.249.1.59947: UDP, length 64
03:04:55.313791 IP 183.16.154.29.49038 > 192.168.198.1.59947: UDP, length 64
03:04:55.313805 IP 183.16.154.29.1036 > 171.223.240.65.59947: UDP, length 65
03:04:55.313898 IP 183.16.154.29.49038 > 171.223.240.65.1036: UDP, length 64
03:04:55.313905 IP 183.16.154.29.1036 > 171.223.240.65.59979: UDP, length 65
03:04:55.324078 IP 183.16.154.29.49038 > 192.168.100.108.59947: UDP, length 66
03:04:55.324091 IP 183.16.154.29.49038 > 192.168.249.1.59947: UDP, length 64
03:04:55.324254 IP 183.16.154.29.1036 > 171.223.240.65.59979: UDP, length 65
03:04:55.324264 IP 183.16.154.29.49038 > 192.168.198.1.59947: UDP, length 64
03:04:55.324276 IP 183.16.154.29.1036 > 171.223.240.65.59947: UDP, length 65
03:04:55.324281 IP 183.16.154.29.49038 > 171.223.240.65.1036: UDP, length 64
03:04:55.537370 IP 183.16.154.29.50747 > server18705.teamviewer.com.5938: UDP, length 16
03:04:56.086257 IP server18705.teamviewer.com.5938 > 183.16.154.29.50747: UDP, length 16
03:04:59.502249 IP 183.60.56.40.8000 > 183.16.154.29.58415: UDP, length 79
03:04:59.738130 IP 183.16.154.29.50747 > server18705.teamviewer.com.5938: UDP, length 16
03:05:00.082653 IP 171.223.240.65.59947 > 183.16.154.29.49038: UDP, length 64
03:05:00.083054 IP 171.223.240.65.1036 > 183.16.154.29.1036: UDP, length 63
03:05:00.083083 IP 171.223.240.65.1036 > 183.16.154.29.49070: UDP, length 64
03:05:00.083326 IP 171.223.240.65.1036 > 183.16.154.29.1036: UDP, length 63
03:05:00.083350 IP 171.223.240.65.1036 > 183.16.154.29.49070: UDP, length 64
03:05:00.093632 IP 171.223.240.65.59947 > 183.16.154.29.49038: UDP, length 64
03:05:00.093948 IP 171.223.240.65.1036 > 183.16.154.29.1036: UDP, length 63
03:05:00.094190 IP 171.223.240.65.1036 > 183.16.154.29.49070: UDP, length 64
03:05:00.094645 IP 171.223.240.65.1036 > 183.16.154.29.1036: UDP, length 63
03:05:00.094675 IP 171.223.240.65.1036 > 183.16.154.29.49070: UDP, length 64
03:05:00.101739 IP server18705.teamviewer.com.5938 > 183.16.154.29.50747: UDP, length 16
03:05:00.105565 IP 171.223.240.65.59947 > 183.16.154.29.49038: UDP, length 64
03:05:00.105821 IP 171.223.240.65.1036 > 183.16.154.29.1036: UDP, length 63
03:05:00.105835 IP 171.223.240.65.1036 > 183.16.154.29.49070: UDP, length 64
03:05:00.106133 IP 171.223.240.65.1036 > 183.16.154.29.1036: UDP, length 63
03:05:00.106145 IP 171.223.240.65.1036 > 183.16.154.29.49070: UDP, length 64
03:05:00.303135 IP 183.16.154.29.49038 > 192.168.100.108.59947: UDP, length 66
03:05:00.303350 IP 183.16.154.29.49038 > 192.168.249.1.59947: UDP, length 64
03:05:00.303360 IP 183.16.154.29.49038 > 192.168.198.1.59947: UDP, length 64
03:05:00.303370 IP 183.16.154.29.1036 > 171.223.240.65.59947: UDP, length 65
03:05:00.303377 IP 183.16.154.29.49038 > 171.223.240.65.1036: UDP, length 64
03:05:00.303382 IP 183.16.154.29.1036 > 171.223.240.65.59979: UDP, length 65
03:05:00.313279 IP 183.16.154.29.49038 > 192.168.100.108.59947: UDP, length 66
03:05:00.313446 IP 183.16.154.29.49038 > 192.168.249.1.59947: UDP, length 64
03:05:00.313453 IP 183.16.154.29.49038 > 192.168.198.1.59947: UDP, length 64
03:05:00.313460 IP 183.16.154.29.1036 > 171.223.240.65.59947: UDP, length 65
03:05:00.313466 IP 183.16.154.29.49038 > 171.223.240.65.1036: UDP, length 64
03:05:00.313470 IP 183.16.154.29.1036 > 171.223.240.65.59979: UDP, length 65
03:05:00.323493 IP 183.16.154.29.49038 > 192.168.100.108.59947: UDP, length 66
03:05:00.323618 IP 183.16.154.29.49038 > 192.168.249.1.59947: UDP, length 64
03:05:00.323625 IP 183.16.154.29.49038 > 192.168.198.1.59947: UDP, length 64
03:05:00.323632 IP 183.16.154.29.1036 > 171.223.240.65.59947: UDP, length 65
03:05:00.323638 IP 183.16.154.29.49038 > 171.223.240.65.1036: UDP, length 64
03:05:00.323643 IP 183.16.154.29.1036 > 171.223.240.65.59979: UDP, length 65
03:05:00.959247 IP 183.60.56.40.8000 > 183.16.154.29.58415: UDP, length 79
03:05:03.851337 IP 183.16.154.29.50747 > server18705.teamviewer.com.5938: UDP, length 16
03:05:04.117319 IP server18705.teamviewer.com.5938 > 183.16.154.29.50747: UDP, length 16
03:05:05.303209 IP 183.16.154.29.49038 > 192.168.100.108.59947: UDP, length 66
03:05:05.303332 IP 183.16.154.29.49038 > 192.168.249.1.59947: UDP, length 64
03:05:05.303341 IP 183.16.154.29.49038 > 192.168.198.1.59947: UDP, length 64
03:05:05.303467 IP 183.16.154.29.1036 > 171.223.240.65.59979: UDP, length 65
03:05:05.303476 IP 183.16.154.29.1036 > 171.223.240.65.59947: UDP, length 65
03:05:05.303487 IP 183.16.154.29.49038 > 171.223.240.65.1036: UDP, length 64
03:05:05.313555 IP 183.16.154.29.49038 > 192.168.100.108.59947: UDP, length 66
03:05:05.313570 IP 183.16.154.29.49038 > 192.168.249.1.59947: UDP, length 64
03:05:05.313717 IP 183.16.154.29.1036 > 171.223.240.65.59979: UDP, length 65
03:05:05.313724 IP 183.16.154.29.49038 > 192.168.198.1.59947: UDP, length 64
03:05:05.313731 IP 183.16.154.29.1036 > 171.223.240.65.59947: UDP, length 65
03:05:05.313738 IP 183.16.154.29.49038 > 171.223.240.65.1036: UDP, length 64
03:05:05.323933 IP 183.16.154.29.49038 > 192.168.100.108.59947: UDP, length 66
03:05:05.323947 IP 183.16.154.29.49038 > 192.168.249.1.59947: UDP, length 64
03:05:05.324043 IP 183.16.154.29.49038 > 192.168.198.1.59947: UDP, length 64
03:05:05.324056 IP 183.16.154.29.1036 > 171.223.240.65.59947: UDP, length 65
03:05:05.324145 IP 183.16.154.29.1036 > 171.223.240.65.59979: UDP, length 65
03:05:05.324154 IP 183.16.154.29.49038 > 171.223.240.65.1036: UDP, length 64
03:05:05.613455 IP 183.16.154.29.46280 > public1.alidns.com.domain: 27446+ A? janson.f3322.net. (34)
03:05:06.096318 IP public1.alidns.com.domain > 183.16.154.29.46280: 27446 1/0/0 A 183.16.154.29 (50)
03:05:07.834141 IP 183.16.154.29.50747 > server18705.teamviewer.com.5938: UDP, length 16
03:05:08.132849 IP server18705.teamviewer.com.5938 > 183.16.154.29.50747: UDP, length 16
