E:\Xiaobao>
E:\Xiaobao>main_client.exe -listen="192.168.1.1:80;0.0.0.0:8890"  -user="janson2
" -password="janson"
2015/12/20 13:57:36 Got clientId: 0
2015/12/20 13:57:36 resetLocalAddrs: [192.168.1.8:56980]
2015/12/20 13:57:36 starting
2015/12/20 13:57:36 resetLocalAddrs: [192.168.1.8:56980 223.73.106.138:35552]
2015/12/20 13:57:56 resetLocalAddrs: [192.168.1.8:56980 223.73.106.138:35586]
2015/12/20 13:58:16 resetLocalAddrs: [192.168.1.8:56980 223.73.106.138:35664]
2015/12/20 13:58:31 create new p2pclient, from= 23 remoteaddrs [192.168.1.23:600
66 172.17.42.1:60066 183.16.171.56:60066]
2015/12/20 13:58:31 shakeOne To 192.168.1.23:60066
2015/12/20 13:58:31 shakeOne To 172.17.42.1:60066
2015/12/20 13:58:31 shakeOne To 183.16.171.56:60066
2015/12/20 13:58:31 shakeOne To 192.168.1.23:35664
2015/12/20 13:58:31 shakeOne To 172.17.42.1:35664
2015/12/20 13:58:31 shakeOne To 183.16.171.56:35664
2015/12/20 13:58:31 shakeOne To 192.168.1.23:60066
2015/12/20 13:58:31 shakeOne To 172.17.42.1:60066
2015/12/20 13:58:31 shakeOne To 183.16.171.56:60066
2015/12/20 13:58:31 shakeOne To 192.168.1.23:35664
2015/12/20 13:58:31 shakeOne To 172.17.42.1:35664
2015/12/20 13:58:31 shakeOne To 183.16.171.56:35664
2015/12/20 13:58:31 shakeOne To 192.168.1.23:60066
2015/12/20 13:58:31 shakeOne To 172.17.42.1:60066
2015/12/20 13:58:31 shakeOne To 183.16.171.56:60066
2015/12/20 13:58:31 shakeOne To 192.168.1.23:35664
2015/12/20 13:58:31 shakeOne To 172.17.42.1:35664
2015/12/20 13:58:31 shakeOne To 183.16.171.56:35664
2015/12/20 13:58:36 resetLocalAddrs: [192.168.1.8:56980 223.73.106.138:35594]
2015/12/20 13:58:37 msg type not found
2015/12/20 13:58:37 Got n= 65 from 183.16.171.56:60066
2015/12/20 13:58:37 handleShakeingMsg sid 223.73.106.138:35594;183.16.171.56:600
66
2015/12/20 13:58:37 shakeOne To 183.16.171.56:60066
2015/12/20 13:58:37 Got n= 65 from 183.16.171.56:60066
2015/12/20 13:58:37 handleShakeingMsg sid 223.73.106.138:35594;183.16.171.56:600
66
2015/12/20 13:58:37 shakeOne To 183.16.171.56:60066
2015/12/20 13:58:37 Got n= 65 from 183.16.171.56:60066
2015/12/20 13:58:37 handleShakeingMsg sid 223.73.106.138:35594;183.16.171.56:600
66


[janson@localhost koolnet]$ ./ctest -user="janson2" -password="janson"
2015/12/20 13:58:30 Got clientId: 23
2015/12/20 13:58:30 resetLocalAddrs: [192.168.1.23:60066 172.17.42.1:60066]
2015/12/20 13:58:30 starting
2015/12/20 13:58:30 resetLocalAddrs: [192.168.1.23:60066 172.17.42.1:60066 183.16.171.56:60066]
2015/12/20 13:58:30 Request from outself
2015/12/20 13:58:30 got from myself [192.168.1.23:60066 172.17.42.1:60066] []
2015/12/20 13:58:30 ips [192.168.1.8:60066 223.73.106.138:60066]
2015/12/20 13:58:30 shakeOne To 192.168.1.8:56980
2015/12/20 13:58:30 shakeOne To 223.73.106.138:35664
2015/12/20 13:58:30 shakeOne To 192.168.1.8:56980
2015/12/20 13:58:30 shakeOne To 223.73.106.138:35664
2015/12/20 13:58:30 shakeOne To 192.168.1.8:56980
2015/12/20 13:58:30 shakeOne To 223.73.106.138:35664
2015/12/20 13:58:30 Notify remote for shaking
2015/12/20 13:58:36 Request from outself
2015/12/20 13:58:36 got from myself [192.168.1.23:60066 172.17.42.1:60066 183.16.171.56:60066] [192.168.1.8:56980 223.73.106.138:35664]
2015/12/20 13:58:36 ips [192.168.1.8:60066 223.73.106.138:60066]
2015/12/20 13:58:36 shakeOne To 192.168.1.8:56980
2015/12/20 13:58:36 shakeOne To 223.73.106.138:35594
2015/12/20 13:58:36 shakeOne To 192.168.1.8:56980
2015/12/20 13:58:36 shakeOne To 223.73.106.138:35594
2015/12/20 13:58:36 shakeOne To 192.168.1.8:56980
2015/12/20 13:58:36 shakeOne To 223.73.106.138:35594
2015/12/20 13:58:36 Notify remote for shaking
2015/12/20 13:58:50 shakeOne To 192.168.1.8:56980
2015/12/20 13:58:50 shakeOne To 223.73.106.138:35594
2015/12/20 13:58:50 shakeOne To 192.168.1.8:56980
2015/12/20 13:58:50 shakeOne To 223.73.106.138:35594
2015/12/20 13:58:50 shakeOne To 192.168.1.8:56980
2015/12/20 13:58:50 shakeOne To 223.73.106.138:35594
2015/12/20 13:58:56 tcpReadLoop error:  message: readMessageError
2015/12/20 13:58:56 waiting for 5s for reconnect



root@OpenWrt:~# tcpdump -i br-lan udp
tcpdump: verbose output suppressed, use -v or -vv for full protocol decode
listening on br-lan, link-type EN10MB (Ethernet), capture size 65535 bytes
13:57:07.148661 IP nas.lan.42784 > 192.168.90.255.65001: UDP, length 20
13:57:07.356923 IP nas.lan.42784 > 192.168.90.255.65001: UDP, length 20
13:57:09.265099 IP nas.lan.netbios-ns > 192.168.90.255.netbios-ns: NBT UDP PACKET(137): QUERY; REQUEST; BROADCAST
13:57:09.265232 IP OpenWrt.lan.netbios-ns > nas.lan.netbios-ns: NBT UDP PACKET(137): QUERY; POSITIVE; RESPONSE; UNICAST
13:57:14.794591 IP 88u.lan.59501 > OpenWrt.lan.domain: 20536+ A? st.liang888.com. (33)
13:57:14.796019 IP 88u.lan.49567 > OpenWrt.lan.domain: 26228+ A? u.liang888.com. (32)
13:57:14.806660 IP OpenWrt.lan.domain > 88u.lan.59501: 20536 1/0/0 A 122.228.216.35 (49)
13:57:14.806717 IP OpenWrt.lan.domain > 88u.lan.49567: 26228 1/0/0 A 209.9.107.152 (48)
13:57:15.659450 IP pmm-pc.lan.50929 > 10.120.156.200.snmp:  GetRequest(63)  25.3.2.1.5.1 25.3.5.1.1.1 25.3.5.1.2.1
13:57:15.659839 IP pmm-pc.lan.50929 > 10.120.156.200.snmp:  GetRequest(63)  25.3.2.1.5.1 25.3.5.1.1.1 25.3.5.1.2.1
13:57:16.916504 IP 183.60.56.20.8000 > 88u.lan.60690: UDP, length 423
13:57:16.918000 IP 88u.lan.60690 > 183.60.56.20.8000: UDP, length 55
13:57:17.263700 IP nas.lan.3027 > 121.9.209.143.8000: UDP, length 90
13:57:18.360902 IP 88u.lan.60690 > 183.60.56.20.8000: UDP, length 143
13:57:18.366514 IP 183.60.56.20.8000 > 88u.lan.60690: UDP, length 495
13:57:18.405472 IP 88u.lan.60690 > 183.60.56.20.8000: UDP, length 39
13:57:18.415447 IP 183.60.56.20.8000 > 88u.lan.60690: UDP, length 55
13:57:18.435881 IP 88u.lan.60690 > 183.60.56.20.8000: UDP, length 47
13:57:18.443605 IP 183.60.56.20.8000 > 88u.lan.60690: UDP, length 159
13:57:18.444888 IP 88u.lan.60690 > 183.60.56.20.8000: UDP, length 47
13:57:18.449145 IP 183.60.56.20.8000 > 88u.lan.60690: UDP, length 103
13:57:18.918197 IP 183.60.56.20.8000 > 88u.lan.60690: UDP, length 263
13:57:18.920037 IP 88u.lan.60690 > 183.60.56.20.8000: UDP, length 55
13:57:23.617973 IP 88u.lan.60953 > 58.220.12.40.8000: UDP, length 54
13:57:23.651748 IP 58.220.12.40.8000 > 88u.lan.60953: UDP, length 36
13:57:23.924230 IP 183.60.56.20.8000 > 88u.lan.60690: UDP, length 79
13:57:25.522158 IP 183.60.56.20.8000 > 88u.lan.60690: UDP, length 79
13:57:25.660497 IP pmm-pc.lan.50929 > 10.120.156.200.snmp:  GetRequest(63)  25.3.2.1.5.1 25.3.5.1.1.1 25.3.5.1.2.1
13:57:25.660752 IP pmm-pc.lan.50929 > 10.120.156.200.snmp:  GetRequest(63)  25.3.2.1.5.1 25.3.5.1.1.1 25.3.5.1.2.1
13:57:26.995487 IP 88u.lan.60690 > 183.60.56.20.8000: UDP, length 63
13:57:26.998596 IP 183.60.56.20.8000 > 88u.lan.60690: UDP, length 39
13:57:27.574284 IP nas.lan.42784 > 192.168.90.255.65001: UDP, length 20
13:57:27.778498 IP nas.lan.42784 > 192.168.90.255.65001: UDP, length 20
13:57:28.606986 IP 183.60.56.20.8000 > 88u.lan.60690: UDP, length 79
13:57:29.611532 IP 88u.lan.ntp > news.neu.edu.cn.ntp: NTPv4, Client, length 48
13:57:29.659768 IP 183.60.56.20.8000 > 88u.lan.60690: UDP, length 271
13:57:29.660985 IP 88u.lan.60690 > 183.60.56.20.8000: UDP, length 55
13:57:31.035388 IP 183.60.56.20.8000 > 88u.lan.60690: UDP, length 79
13:57:31.326175 IP 183.60.56.20.8000 > 88u.lan.60690: UDP, length 271
13:57:31.327811 IP 88u.lan.60690 > 183.60.56.20.8000: UDP, length 55
13:57:32.195900 IP 88u.lan.60690 > 183.60.56.20.8000: UDP, length 47
13:57:32.200892 IP 183.60.56.20.8000 > 88u.lan.60690: UDP, length 31
13:57:32.801801 IP 88u.lan.60690 > 183.60.56.20.8000: UDP, length 63
13:57:32.808770 IP 183.60.56.20.8000 > 88u.lan.60690: UDP, length 583
13:57:32.815674 IP 88u.lan.60690 > 183.60.56.20.8000: UDP, length 87
13:57:32.829483 IP 183.60.56.20.8000 > 88u.lan.60690: UDP, length 47
13:57:33.320516 IP 183.60.56.20.8000 > 88u.lan.60690: UDP, length 79
13:57:34.630382 IP 183.60.56.20.8000 > 88u.lan.60690: UDP, length 79
13:57:36.149896 IP nas.lan.41161 > OpenWrt.lan.domain: 65271+ A? nat.emule.org.cn. (34)
13:57:36.157508 IP OpenWrt.lan.domain > nas.lan.41161: 65271 0/1/0 (111)
13:57:36.157813 IP nas.lan.50318 > OpenWrt.lan.domain: 18021+ A? nat.emule.org.cn. (34)
13:57:36.157877 IP OpenWrt.lan.domain > nas.lan.50318: 18021 0/0/0 (34)
13:57:36.239260 IP 183.60.56.20.8000 > 88u.lan.60690: UDP, length 79
13:57:36.424083 IP 183.60.56.20.8000 > 88u.lan.60690: UDP, length 79




13:57:36.537279 IP6 fd75:c7ac:149a:0:20af:3788:ae2c:94fc.53644 > fd75:c7ac:149a::1.domain: 35365+ A? task.alibench.com. (35)
13:57:36.544331 IP6 fd75:c7ac:149a::1.domain > fd75:c7ac:149a:0:20af:3788:ae2c:94fc.53644: 35365 1/0/0 A 140.205.156.228 (51)
13:57:36.638938 IP 183.60.56.20.8000 > 88u.lan.60690: UDP, length 263
13:57:36.640445 IP 88u.lan.60690 > 183.60.56.20.8000: UDP, length 55
13:57:36.757974 IP 183.60.56.20.8000 > 88u.lan.60690: UDP, length 79
13:57:38.849157 IP nas.lan.3027 > 183.60.209.80.8000: UDP, length 39
13:57:38.854956 IP 183.60.209.80.8000 > nas.lan.3027: UDP, length 25
13:57:39.891435 IP 183.60.56.20.8000 > 88u.lan.60690: UDP, length 223
13:57:39.892855 IP 88u.lan.60690 > 183.60.56.20.8000: UDP, length 55
13:57:40.116043 IP 183.60.56.20.8000 > 88u.lan.60690: UDP, length 231
13:57:40.117267 IP 88u.lan.60690 > 183.60.56.20.8000: UDP, length 55
13:57:40.562435 IP 88u.lan.ntp > 202.118.1.130.ntp: NTPv4, Client, length 48
13:57:40.701743 IP 202.118.1.130.ntp > 88u.lan.ntp: NTPv3, Server, length 48
13:57:40.725037 IP nas.lan.58187 > OpenWrt.lan.domain: 21250+ A? tRACkER.publicbT.com. (38)
13:57:40.725485 IP6 DiskStation.lan.53609 > fd75:c7ac:149a::1.domain: 6827+ AAAA? TrAcKer.pUBliCBT.Com. (38)
13:57:40.732065 IP6 fd75:c7ac:149a::1.domain > DiskStation.lan.53609: 6827 NXDomain 0/1/0 (111)
13:57:40.732336 IP OpenWrt.lan.domain > nas.lan.58187: 21250 NXDomain 0/1/0 (111)
13:57:41.025874 IP 88u.lan.53789 > 183.60.209.36.80: UDP, length 172
13:57:41.033849 IP 183.60.209.36.80 > 88u.lan.53789: UDP, length 28
13:57:42.728260 IP 88u.lan.60690 > 183.60.56.20.8000: UDP, length 47
13:57:42.734300 IP 183.60.56.20.8000 > 88u.lan.60690: UDP, length 39
13:58:01.136209 IP 183.60.56.20.8000 > 88u.lan.60690: UDP, length 79
13:58:02.728437 IP 88u.lan.60690 > 183.60.56.20.8000: UDP, length 95
13:58:02.735505 IP 183.60.56.20.8000 > 88u.lan.60690: UDP, length 135
13:58:03.612871 IP 183.60.56.20.8000 > 88u.lan.60690: UDP, length 79
13:58:03.783050 IP 183.60.56.20.8000 > 88u.lan.60690: UDP, length 79
13:58:05.461418 IP pmm-pc.lan.50929 > 10.120.156.200.snmp:  GetRequest(63)  25.3.2.1.5.1 25.3.5.1.1.1 25.3.5.1.2.1
13:58:05.461612 IP pmm-pc.lan.50929 > 10.120.156.200.snmp:  GetRequest(63)  25.3.2.1.5.1 25.3.5.1.1.1 25.3.5.1.2.1
13:58:05.988576 IP 183.60.56.20.8000 > 88u.lan.60690: UDP, length 79
13:58:06.235691 IP 183.60.56.20.8000 > 88u.lan.60690: UDP, length 79
13:58:06.239852 IP 88u.lan.60690 > 183.60.56.20.8000: UDP, length 47
13:58:06.242331 IP 183.60.56.20.8000 > 88u.lan.60690: UDP, length 39
13:58:08.405459 IP nas.lan.42784 > 192.168.90.255.65001: UDP, length 20
13:58:08.613643 IP nas.lan.42784 > 192.168.90.255.65001: UDP, length 20
13:58:08.618702 IP 88u.lan.60953 > 58.220.12.40.8000: UDP, length 54
13:58:08.669061 IP 58.220.12.40.8000 > 88u.lan.60953: UDP, length 34
13:58:09.656394 IP 183.60.56.20.8000 > 88u.lan.60690: UDP, length 455
13:58:09.657675 IP 88u.lan.60690 > 183.60.56.20.8000: UDP, length 55
13:58:11.767056 IP 183.60.56.20.8000 > 88u.lan.60690: UDP, length 79
13:58:11.791756 IP 183.60.56.20.8000 > 88u.lan.60690: UDP, length 79

13:58:14.324526 IP 183.60.56.20.8000 > 88u.lan.60690: UDP, length 231
13:58:14.326074 IP 88u.lan.60690 > 183.60.56.20.8000: UDP, length 55
13:58:15.300634 IP 183.60.56.20.8000 > 88u.lan.60690: UDP, length 215
13:58:15.302198 IP 88u.lan.60690 > 183.60.56.20.8000: UDP, length 55
13:58:15.530003 IP 183.60.56.20.8000 > 88u.lan.60690: UDP, length 79
13:58:15.665590 IP pmm-pc.lan.50929 > 10.120.156.200.snmp:  GetRequest(63)  25.3.2.1.5.1 25.3.5.1.1.1 25.3.5.1.2.1
13:58:15.665861 IP pmm-pc.lan.50929 > 10.120.156.200.snmp:  GetRequest(63)  25.3.2.1.5.1 25.3.5.1.1.1 25.3.5.1.2.1
13:58:17.560094 IP 183.60.56.20.8000 > 88u.lan.60690: UDP, length 79
13:58:18.476946 IP 183.60.56.20.8000 > 88u.lan.60690: UDP, length 79
13:58:18.878886 IP 183.60.56.20.8000 > 88u.lan.60690: UDP, length 79
13:58:23.843858 IP nas.lan.3027 > 183.60.209.80.8000: UDP, length 39
13:58:23.851664 IP 183.60.209.80.8000 > nas.lan.3027: UDP, length 25
13:58:25.666433 IP pmm-pc.lan.50929 > 10.120.156.200.snmp:  GetRequest(63)  25.3.2.1.5.1 25.3.5.1.1.1 25.3.5.1.2.1
13:58:25.666626 IP pmm-pc.lan.50929 > 10.120.156.200.snmp:  GetRequest(63)  25.3.2.1.5.1 25.3.5.1.1.1 25.3.5.1.2.1
13:58:28.831010 IP nas.lan.42784 > 192.168.90.255.65001: UDP, length 20
13:58:29.039233 IP nas.lan.42784 > 192.168.90.255.65001: UDP, length 20
13:58:29.683209 IP 88u.lan.19942 > OpenWrt.lan.domain: 62008+ AAAA? ngrok.wang. (28)
13:58:30.212717 IP OpenWrt.lan.domain > 88u.lan.19942: 62008 0/1/0 (91)
13:58:30.449625 IP 88u.lan.34306 > OpenWrt.lan.domain: 7265+ AAAA? ngrok.wang. (28)
13:58:30.449691 IP OpenWrt.lan.domain > 88u.lan.34306: 7265 0/0/0 (28)
13:58:30.453529 IP 88u.lan.60066 > 115.28.237.155.18886: UDP, length 107


13:58:30.604956 IP 88u.lan.60066 > 223.73.106.138.35664: UDP, length 65
13:58:30.615019 IP 88u.lan.60066 > 223.73.106.138.35664: UDP, length 65
13:58:30.625183 IP 88u.lan.60066 > 223.73.106.138.35664: UDP, length 65
13:58:31.665500 IP 183.60.56.20.8000 > 88u.lan.60690: UDP, length 79
13:58:32.445069 IP 183.60.56.20.8000 > 88u.lan.60690: UDP, length 239
13:58:32.446599 IP 88u.lan.60690 > 183.60.56.20.8000: UDP, length 55
13:58:36.138746 IP nas.lan.35922 > OpenWrt.lan.domain: 9792+ A? nat.emule.org.cn. (34)
13:58:36.138837 IP OpenWrt.lan.domain > nas.lan.35922: 9792 0/0/0 (34)
13:58:36.139088 IP nas.lan.52071 > OpenWrt.lan.domain: 13908+ A? nat.emule.org.cn. (34)
13:58:36.139139 IP OpenWrt.lan.domain > nas.lan.52071: 13908 0/0/0 (34)
13:58:36.181271 IP 88u.lan.60066 > 223.73.106.138.35594: UDP, length 65
13:58:36.191341 IP 88u.lan.60066 > 223.73.106.138.35594: UDP, length 65
13:58:36.201470 IP 88u.lan.60066 > 223.73.106.138.35594: UDP, length 65
13:58:47.119771 IP 183.60.56.20.8000 > 88u.lan.60690: UDP, length 223
13:58:47.121986 IP 88u.lan.60690 > 183.60.56.20.8000: UDP, length 55
13:58:48.727351 IP 88u.lan.60690 > 183.60.56.20.8000: UDP, length 39
13:58:48.753423 IP 183.60.56.20.8000 > 88u.lan.60690: UDP, length 951
13:58:48.768262 IP 88u.lan.60690 > 183.60.56.20.8000: UDP, length 39
13:58:49.005192 IP 192.168.90.104.44280 > OpenWrt.lan.domain: 56160+ AAAA? www.baidu.com. (31)
13:58:49.011051 IP 183.60.56.20.8000 > 88u.lan.60690: UDP, length 999
13:58:49.013096 IP OpenWrt.lan.domain > 192.168.90.104.44280: 56160 1/1/0 CNAME www.a.shifen.com. (115)
13:58:49.017737 IP 192.168.90.104.31941 > OpenWrt.lan.domain: 27016+ A? www.baidu.com. (31)
13:58:49.020432 IP 88u.lan.60690 > 183.60.56.20.8000: UDP, length 39
13:58:49.027839 IP OpenWrt.lan.domain > 192.168.90.104.31941: 27016 3/0/0 CNAME www.a.shifen.com., A 14.215.177.37, A 14.215.177.38 (90)
13:58:49.028687 IP 183.60.56.20.8000 > 88u.lan.60690: UDP, length 871
13:58:49.037598 IP 88u.lan.60690 > 183.60.56.20.8000: UDP, length 39
13:58:49.048456 IP 183.60.56.20.8000 > 88u.lan.60690: UDP, length 911
13:58:49.050262 IP 88u.lan.60690 > 183.60.56.20.8000: UDP, length 47
13:58:49.055625 IP 88u.lan.60690 > 183.60.56.20.8000: UDP, length 39
13:58:49.056711 IP 183.60.56.20.8000 > 88u.lan.60690: UDP, length 255
13:58:49.066320 IP 183.60.56.20.8000 > 88u.lan.60690: UDP, length 831
13:58:49.070305 IP 88u.lan.60690 > 183.60.56.20.8000: UDP, length 39
13:58:49.191282 IP 183.60.56.20.8000 > 88u.lan.60690: UDP, length 999
13:58:49.198288 IP 88u.lan.60690 > 183.60.56.20.8000: UDP, length 39
13:58:49.256553 IP nas.lan.42784 > 192.168.90.255.65001: UDP, length 20
13:58:49.259335 IP 183.60.56.20.8000 > 88u.lan.60690: UDP, length 999
13:58:49.268232 IP 88u.lan.60690 > 183.60.56.20.8000: UDP, length 39
13:58:49.277852 IP 183.60.56.20.8000 > 88u.lan.60690: UDP, length 951
13:58:49.285517 IP 88u.lan.60690 > 183.60.56.20.8000: UDP, length 39
13:58:49.292960 IP 183.60.56.20.8000 > 88u.lan.60690: UDP, length 951
13:58:49.308946 IP 88u.lan.60690 > 183.60.56.20.8000: UDP, length 39
13:58:49.329483 IP 183.60.56.20.8000 > 88u.lan.60690: UDP, length 1039
13:58:49.332596 IP 88u.lan.60690 > 183.60.56.20.8000: UDP, length 39
13:58:49.364021 IP 183.60.56.20.8000 > 88u.lan.60690: UDP, length 911
13:58:49.369293 IP 88u.lan.60690 > 183.60.56.20.8000: UDP, length 39
13:58:49.384882 IP 183.60.56.20.8000 > 88u.lan.60690: UDP, length 999
13:58:49.393157 IP 88u.lan.60690 > 183.60.56.20.8000: UDP, length 39
13:58:49.403555 IP 183.60.56.20.8000 > 88u.lan.60690: UDP, length 871
13:58:49.409359 IP 88u.lan.60690 > 183.60.56.20.8000: UDP, length 39
13:58:49.420055 IP 183.60.56.20.8000 > 88u.lan.60690: UDP, length 951
13:58:49.424274 IP 88u.lan.60690 > 183.60.56.20.8000: UDP, length 39
13:58:49.433254 IP 183.60.56.20.8000 > 88u.lan.60690: UDP, length 951
13:58:49.438324 IP 88u.lan.60690 > 183.60.56.20.8000: UDP, length 39
13:58:49.464844 IP nas.lan.42784 > 192.168.90.255.65001: UDP, length 20
13:58:49.511870 IP 183.60.56.20.8000 > 88u.lan.60690: UDP, length 871
13:58:49.517076 IP 88u.lan.60690 > 183.60.56.20.8000: UDP, length 39
13:58:49.525289 IP 183.60.56.20.8000 > 88u.lan.60690: UDP, length 999
13:58:49.533769 IP 88u.lan.60690 > 183.60.56.20.8000: UDP, length 39
13:58:49.546501 IP 183.60.56.20.8000 > 88u.lan.60690: UDP, length 783
13:58:49.553789 IP 88u.lan.60690 > 183.60.56.20.8000: UDP, length 39
13:58:49.563366 IP 183.60.56.20.8000 > 88u.lan.60690: UDP, length 783
13:58:49.568650 IP 88u.lan.60690 > 183.60.56.20.8000: UDP, length 39
13:58:49.582232 IP 183.60.56.20.8000 > 88u.lan.60690: UDP, length 871
13:58:49.591570 IP 88u.lan.60690 > 183.60.56.20.8000: UDP, length 39
13:58:49.601205 IP 183.60.56.20.8000 > 88u.lan.60690: UDP, length 871
13:58:49.605047 IP 88u.lan.60690 > 183.60.56.20.8000: UDP, length 39
13:58:49.611662 IP 183.60.56.20.8000 > 88u.lan.60690: UDP, length 951
13:58:49.614777 IP 88u.lan.60690 > 183.60.56.20.8000: UDP, length 39
13:58:49.629628 IP 183.60.56.20.8000 > 88u.lan.60690: UDP, length 783
13:58:49.632559 IP 88u.lan.60690 > 183.60.56.20.8000: UDP, length 39
13:58:49.639054 IP 183.60.56.20.8000 > 88u.lan.60690: UDP, length 871
13:58:49.642053 IP 88u.lan.60690 > 183.60.56.20.8000: UDP, length 39
13:58:49.650078 IP 183.60.56.20.8000 > 88u.lan.60690: UDP, length 871
13:58:49.654096 IP 88u.lan.60690 > 183.60.56.20.8000: UDP, length 39
13:58:49.672579 IP 183.60.56.20.8000 > 88u.lan.60690: UDP, length 871
13:58:49.685613 IP 88u.lan.60690 > 183.60.56.20.8000: UDP, length 39
13:58:49.694832 IP 183.60.56.20.8000 > 88u.lan.60690: UDP, length 871
13:58:49.701966 IP 88u.lan.60690 > 183.60.56.20.8000: UDP, length 39
13:58:49.716415 IP 183.60.56.20.8000 > 88u.lan.60690: UDP, length 871
13:58:49.718575 IP 88u.lan.60690 > 183.60.56.20.8000: UDP, length 39
13:58:49.728958 IP 183.60.56.20.8000 > 88u.lan.60690: UDP, length 615
13:58:49.737322 IP 88u.lan.60690 > 183.60.56.20.8000: UDP, length 55
13:58:49.741625 IP 183.60.56.20.8000 > 88u.lan.60690: UDP, length 55
13:58:50.453268 IP 88u.lan.60066 > 115.28.237.155.18886: UDP, length 129
13:58:50.453457 IP 88u.lan.60066 > 223.73.106.138.35594: UDP, length 65
13:58:50.463655 IP 88u.lan.60066 > 223.73.106.138.35594: UDP, length 65
13:58:50.473906 IP 88u.lan.60066 > 223.73.106.138.35594: UDP, length 65
13:58:51.783691 IP 183.60.56.20.8000 > 88u.lan.60690: UDP, length 79
13:58:52.526373 IP 183.60.56.20.8000 > 88u.lan.60690: UDP, length 79
13:58:53.641404 IP 88u.lan.60953 > 58.220.12.40.8000: UDP, length 56
13:58:53.669738 IP 58.220.12.40.8000 > 88u.lan.60953: UDP, length 36
13:58:54.139771 IP 183.60.56.20.8000 > 88u.lan.60690: UDP, length 279
13:58:54.141293 IP 88u.lan.60690 > 183.60.56.20.8000: UDP, length 55
13:58:54.278222 IP 88u.lan.60690 > 183.60.56.20.8000: UDP, length 39
13:58:54.285815 IP 183.60.56.20.8000 > 88u.lan.60690: UDP, length 47
13:58:55.615475 IP 88u.lan.60690 > 183.60.56.20.8000: UDP, length 87
13:58:55.684793 IP 183.60.56.20.8000 > 88u.lan.60690: UDP, length 47
