PPTP

root@OpenWrt:~# tcpdump -i pppoe-wan udp
tcpdump: verbose output suppressed, use -v or -vv for full protocol decode
listening on pppoe-wan, link-type LINUX_SLL (Linux cooked), capture size 65535 bytes


16:53:28.674774 IP 183.16.171.56.65050 > public1.alidns.com.domain: 42880+ AAAA? ngrok.wang. (28)
16:53:28.676137 IP 183.16.171.56.41692 > public1.alidns.com.domain: 13579+ A? ngrok.wang. (28)
16:53:29.196358 IP public1.alidns.com.domain > 183.16.171.56.41692: 13579 1/0/0 A 115.28.237.155 (44)
16:53:29.199303 IP public1.alidns.com.domain > 183.16.171.56.65050: 42880 0/1/0 (91)
16:53:29.421237 IP 183.16.171.56.59213 > 115.28.237.155.18886: UDP, length 54
16:53:29.421575 IP 183.16.171.56.39638 > public1.alidns.com.domain: 26161+ PTR? 56.171.16.183.in-addr.arpa. (44)
16:53:29.430611 IP public1.alidns.com.domain > 183.16.171.56.39638: 26161 NXDomain 0/1/0 (133)
16:53:29.431033 IP 183.16.171.56.19602 > public1.alidns.com.domain: 25667+ PTR? 5.5.5.223.in-addr.arpa. (40)
16:53:29.439704 IP public1.alidns.com.domain > 183.16.171.56.19602: 25667 1/0/0 PTR public1.alidns.com. (72)
16:53:29.468761 IP 115.28.237.155.18886 > 183.16.171.56.59213: UDP, length 73

16:53:29.751582 IP 183.16.171.56.59213 > 59.66.42.98.33147: UDP, length 62
16:53:29.751759 IP 183.16.171.56.59213 > 10.10.2.1.33147: UDP, length 60
16:53:29.751772 IP 183.16.171.56.59213 > 10.0.1.9.33147: UDP, length 59
16:53:29.751931 IP 183.16.171.56.59213 > 166.111.135.19.33147: UDP, length 65
16:53:29.751942 IP 183.16.171.56.59213 > 166.111.135.19.48257: UDP, length 65
16:53:29.761708 IP 183.16.171.56.59213 > 59.66.42.98.33147: UDP, length 62
16:53:29.761726 IP 183.16.171.56.59213 > 10.10.2.1.33147: UDP, length 60
16:53:29.761816 IP 183.16.171.56.59213 > 10.0.1.9.33147: UDP, length 59
16:53:29.761834 IP 183.16.171.56.59213 > 166.111.135.19.33147: UDP, length 65
16:53:29.761848 IP 183.16.171.56.59213 > 166.111.135.19.48257: UDP, length 65
16:53:29.771957 IP 183.16.171.56.59213 > 59.66.42.98.33147: UDP, length 62
16:53:29.771973 IP 183.16.171.56.59213 > 10.10.2.1.33147: UDP, length 60
16:53:29.772110 IP 183.16.171.56.59213 > 10.0.1.9.33147: UDP, length 59
16:53:29.772122 IP 183.16.171.56.59213 > 166.111.135.19.33147: UDP, length 65
16:53:29.772133 IP 183.16.171.56.59213 > 166.111.135.19.48257: UDP, length 65
16:53:29.927617 IP 183.16.171.56.59213 > 59.66.42.98.33147: UDP, length 62
16:53:29.927733 IP 183.16.171.56.59213 > 10.10.2.1.33147: UDP, length 60
16:53:29.927744 IP 183.16.171.56.59213 > 10.0.1.9.33147: UDP, length 59
16:53:29.927759 IP 183.16.171.56.59213 > 166.111.135.19.48257: UDP, length 65
16:53:29.927765 IP 183.16.171.56.59213 > 166.111.135.19.33147: UDP, length 65
16:53:29.937936 IP 183.16.171.56.59213 > 59.66.42.98.33147: UDP, length 62
16:53:29.937950 IP 183.16.171.56.59213 > 10.10.2.1.33147: UDP, length 60
16:53:29.938048 IP 183.16.171.56.59213 > 10.0.1.9.33147: UDP, length 59
16:53:29.938061 IP 183.16.171.56.59213 > 166.111.135.19.33147: UDP, length 65
16:53:29.938072 IP 183.16.171.56.59213 > 166.111.135.19.48257: UDP, length 65
16:53:29.948315 IP 183.16.171.56.59213 > 59.66.42.98.33147: UDP, length 62
16:53:29.948329 IP 183.16.171.56.59213 > 10.10.2.1.33147: UDP, length 60
16:53:29.948504 IP 183.16.171.56.59213 > 10.0.1.9.33147: UDP, length 59
16:53:29.948519 IP 183.16.171.56.59213 > 166.111.135.19.33147: UDP, length 65
16:53:29.948530 IP 183.16.171.56.59213 > 166.111.135.19.48257: UDP, length 65
16:53:29.964572 IP 166.111.135.19.48289 > 183.16.171.56.59213: UDP, length 64
16:53:29.974587 IP 166.111.135.19.48289 > 183.16.171.56.59213: UDP, length 64
16:53:29.986065 IP 166.111.135.19.48289 > 183.16.171.56.59213: UDP, length 64
16:53:30.441534 IP 183.16.171.56.41611 > public1.alidns.com.domain: 44128+ PTR? 155.237.28.115.in-addr.arpa. (45)
16:53:30.970368 IP public1.alidns.com.domain > 183.16.171.56.41611: 44128 NXDomain 0/0/0 (45)
16:53:30.971113 IP 183.16.171.56.25692 > public1.alidns.com.domain: 28617+ PTR? 98.42.66.59.in-addr.arpa. (42)
16:53:34.421186 IP 183.16.171.56.59213 > 59.66.42.98.33147: UDP, length 62
16:53:34.421353 IP 183.16.171.56.59213 > 10.10.2.1.33147: UDP, length 60
16:53:34.421362 IP 183.16.171.56.59213 > 10.0.1.9.33147: UDP, length 59
16:53:34.421367 IP 183.16.171.56.59213 > 166.111.135.19.33147: UDP, length 65
16:53:34.421372 IP 183.16.171.56.59213 > 166.111.135.19.48257: UDP, length 65
16:53:34.431504 IP 183.16.171.56.59213 > 59.66.42.98.33147: UDP, length 62
16:53:34.431515 IP 183.16.171.56.59213 > 10.10.2.1.33147: UDP, length 60
16:53:34.431667 IP 183.16.171.56.59213 > 10.0.1.9.33147: UDP, length 59
16:53:34.431678 IP 183.16.171.56.59213 > 166.111.135.19.33147: UDP, length 65
16:53:34.431688 IP 183.16.171.56.59213 > 166.111.135.19.48257: UDP, length 65
16:53:34.441819 IP 183.16.171.56.59213 > 59.66.42.98.33147: UDP, length 62
16:53:34.441835 IP 183.16.171.56.59213 > 10.10.2.1.33147: UDP, length 60
16:53:34.441927 IP 183.16.171.56.59213 > 10.0.1.9.33147: UDP, length 59
16:53:34.441937 IP 183.16.171.56.59213 > 166.111.135.19.33147: UDP, length 65
16:53:34.441946 IP 183.16.171.56.59213 > 166.111.135.19.48257: UDP, length 65
16:53:34.726484 IP 166.111.135.19.48289 > 183.16.171.56.59213: UDP, length 64
16:53:34.737746 IP 166.111.135.19.48289 > 183.16.171.56.59213: UDP, length 64
16:53:34.748056 IP 166.111.135.19.48289 > 183.16.171.56.59213: UDP, length 64
16:53:35.976191 IP 183.16.171.56.53514 > public1.alidns.com.domain: 38312+ PTR? 98.42.66.59.in-addr.arpa. (42)
16:53:44.421173 IP 183.16.171.56.59213 > 59.66.42.98.33147: UDP, length 62
16:53:44.421294 IP 183.16.171.56.59213 > 10.10.2.1.33147: UDP, length 60
16:53:44.421305 IP 183.16.171.56.59213 > 10.0.1.9.33147: UDP, length 59
16:53:44.421434 IP 183.16.171.56.59213 > 166.111.135.19.33147: UDP, length 65
16:53:44.421448 IP 183.16.171.56.59213 > 166.111.135.19.48257: UDP, length 65
16:53:44.431522 IP 183.16.171.56.59213 > 59.66.42.98.33147: UDP, length 62
16:53:44.431650 IP 183.16.171.56.59213 > 10.10.2.1.33147: UDP, length 60
16:53:44.431657 IP 183.16.171.56.59213 > 10.0.1.9.33147: UDP, length 59
16:53:44.431664 IP 183.16.171.56.59213 > 166.111.135.19.33147: UDP, length 65
16:53:44.431670 IP 183.16.171.56.59213 > 166.111.135.19.48257: UDP, length 65
16:53:44.441877 IP 183.16.171.56.59213 > 59.66.42.98.33147: UDP, length 62
16:53:44.441892 IP 183.16.171.56.59213 > 10.10.2.1.33147: UDP, length 60
16:53:44.441993 IP 183.16.171.56.59213 > 10.0.1.9.33147: UDP, length 59
16:53:44.442004 IP 183.16.171.56.59213 > 166.111.135.19.33147: UDP, length 65
16:53:44.442015 IP 183.16.171.56.59213 > 166.111.135.19.48257: UDP, length 65
16:53:44.716489 IP 166.111.135.19.48289 > 183.16.171.56.59213: UDP, length 64
16:53:44.727722 IP 166.111.135.19.48289 > 183.16.171.56.59213: UDP, length 64
16:53:44.738262 IP 166.111.135.19.48289 > 183.16.171.56.59213: UDP, length 64







root@OpenWrt:~# tcpdump -i pppoe-wan udp
tcpdump: verbose output suppressed, use -v or -vv for full protocol decode
listening on pppoe-wan, link-type LINUX_SLL (Linux cooked), capture size 65535 bytes
17:00:53.445791 IP 183.16.171.56.49897 > public1.alidns.com.domain: 2270+ A? www.baidu.com. (31)
17:00:53.453328 IP public1.alidns.com.domain > 183.16.171.56.49897: 2270 3/0/0 CNAME www.a.shifen.com., A 14.215.177.38, A 14.215.177.37 (90)
17:00:57.554126 IP 183.16.171.56.1981 > public1.alidns.com.domain: 9692+ AAAA? ngrok.wang. (28)
17:00:57.560433 IP public1.alidns.com.domain > 183.16.171.56.1981: 9692 0/1/0 (91)
17:00:57.778166 IP 183.16.171.56.53193 > 115.28.237.155.18886: UDP, length 54
17:00:57.833859 IP 115.28.237.155.18886 > 183.16.171.56.53193: UDP, length 73
17:00:58.013811 IP 183.16.171.56.53193 > 59.66.42.98.42626: UDP, length 62
17:00:58.013932 IP 183.16.171.56.53193 > 10.10.2.1.42626: UDP, length 60
17:00:58.013956 IP 183.16.171.56.53193 > 10.0.1.9.42626: UDP, length 59
17:00:58.014189 IP 183.16.171.56.53193 > 166.111.135.19.42626: UDP, length 65
17:00:58.014210 IP 183.16.171.56.53193 > 166.111.135.19.49697: UDP, length 65
17:00:58.024149 IP 183.16.171.56.53193 > 59.66.42.98.42626: UDP, length 62
17:00:58.024263 IP 183.16.171.56.53193 > 166.111.135.19.42626: UDP, length 65
17:00:58.024271 IP 183.16.171.56.53193 > 10.10.2.1.42626: UDP, length 60
17:00:58.024286 IP 183.16.171.56.53193 > 10.0.1.9.42626: UDP, length 59
17:00:58.024297 IP 183.16.171.56.53193 > 166.111.135.19.49697: UDP, length 65
17:00:58.034453 IP 183.16.171.56.53193 > 10.10.2.1.42626: UDP, length 60
17:00:58.034461 IP 183.16.171.56.53193 > 59.66.42.98.42626: UDP, length 62
17:00:58.034612 IP 183.16.171.56.53193 > 10.0.1.9.42626: UDP, length 59
17:00:58.034620 IP 183.16.171.56.53193 > 166.111.135.19.42626: UDP, length 65
17:00:58.034625 IP 183.16.171.56.53193 > 166.111.135.19.49697: UDP, length 65
17:00:58.196241 IP 183.16.171.56.53193 > 10.10.2.1.42626: UDP, length 60
17:00:58.196249 IP 183.16.171.56.53193 > 59.66.42.98.42626: UDP, length 62
17:00:58.196357 IP 183.16.171.56.53193 > 10.0.1.9.42626: UDP, length 59
17:00:58.196365 IP 183.16.171.56.53193 > 166.111.135.19.42626: UDP, length 65
17:00:58.196460 IP 183.16.171.56.53193 > 166.111.135.19.49697: UDP, length 65
17:00:58.206641 IP 183.16.171.56.53193 > 10.10.2.1.42626: UDP, length 60
17:00:58.206647 IP 183.16.171.56.53193 > 59.66.42.98.42626: UDP, length 62
17:00:58.206776 IP 183.16.171.56.53193 > 10.0.1.9.42626: UDP, length 59
17:00:58.206783 IP 183.16.171.56.53193 > 166.111.135.19.42626: UDP, length 65
17:00:58.206887 IP 183.16.171.56.53193 > 166.111.135.19.49697: UDP, length 65
17:00:58.217092 IP 183.16.171.56.53193 > 10.10.2.1.42626: UDP, length 60
17:00:58.217099 IP 183.16.171.56.53193 > 59.66.42.98.42626: UDP, length 62
17:00:58.217246 IP 183.16.171.56.53193 > 10.0.1.9.42626: UDP, length 59
17:00:58.217254 IP 183.16.171.56.53193 > 166.111.135.19.42626: UDP, length 65
17:00:58.217259 IP 183.16.171.56.53193 > 166.111.135.19.49697: UDP, length 65
17:00:58.230747 IP 166.111.135.19.49729 > 183.16.171.56.53193: UDP, length 64
17:00:58.242770 IP 166.111.135.19.49729 > 183.16.171.56.53193: UDP, length 64
17:00:58.252890 IP 166.111.135.19.49729 > 183.16.171.56.53193: UDP, length 64
17:00:58.661059 IP 183.16.171.56.19714 > public1.alidns.com.domain: 64415+ PTR? 155.237.28.115.in-addr.arpa. (45)
17:00:59.145416 IP public1.alidns.com.domain > 183.16.171.56.19714: 64415 NXDomain 0/0/0 (45)
17:01:02.778070 IP 183.16.171.56.53193 > 59.66.42.98.42626: UDP, length 62
17:01:02.778281 IP 183.16.171.56.53193 > 166.111.135.19.42626: UDP, length 65
17:01:02.778290 IP 183.16.171.56.53193 > 10.10.2.1.42626: UDP, length 60
17:01:02.778295 IP 183.16.171.56.53193 > 10.0.1.9.42626: UDP, length 59
17:01:02.778309 IP 183.16.171.56.53193 > 166.111.135.19.49697: UDP, length 65
17:01:02.788338 IP 183.16.171.56.53193 > 59.66.42.98.42626: UDP, length 62
17:01:02.788346 IP 183.16.171.56.53193 > 10.10.2.1.42626: UDP, length 60
17:01:02.788531 IP 183.16.171.56.53193 > 10.0.1.9.42626: UDP, length 59
17:01:02.788540 IP 183.16.171.56.53193 > 166.111.135.19.42626: UDP, length 65
17:01:02.788550 IP 183.16.171.56.53193 > 166.111.135.19.49697: UDP, length 65
17:01:02.798665 IP 183.16.171.56.53193 > 10.10.2.1.42626: UDP, length 60
17:01:02.798675 IP 183.16.171.56.53193 > 59.66.42.98.42626: UDP, length 62
17:01:02.798814 IP 183.16.171.56.53193 > 10.0.1.9.42626: UDP, length 59
17:01:02.798821 IP 183.16.171.56.53193 > 166.111.135.19.42626: UDP, length 65
17:01:02.798830 IP 183.16.171.56.53193 > 166.111.135.19.49697: UDP, length 65
17:01:03.014990 IP 166.111.135.19.49729 > 183.16.171.56.53193: UDP, length 64
17:01:03.025452 IP 166.111.135.19.49729 > 183.16.171.56.53193: UDP, length 64
17:01:03.038161 IP 166.111.135.19.49729 > 183.16.171.56.53193: UDP, length 64
17:01:08.018236 IP 166.111.135.19.49729 > 183.16.171.56.53193: UDP, length 64
17:01:08.028863 IP 166.111.135.19.49729 > 183.16.171.56.53193: UDP, length 64
17:01:08.040145 IP 166.111.135.19.49729 > 183.16.171.56.53193: UDP, length 64
