root@OpenWrt:~# tcpdump -i pppoe-wan udp
tcpdump: verbose output suppressed, use -v or -vv for full protocol decode
listening on pppoe-wan, link-type LINUX_SLL (Linux cooked), capture size 65535 bytes
12:34:54.670814 IP 183.16.171.56.35282 > 58.220.12.40.8000: UDP, length 54
12:34:54.701155 IP 58.220.12.40.8000 > 183.16.171.56.35282: UDP, length 36
12:34:55.125991 IP 183.16.171.56.55058 > public1.alidns.com.domain: 59559+ PTR? 40.12.220.58.in-addr.arpa. (43)
12:34:55.133311 IP public1.alidns.com.domain > 183.16.171.56.55058: 59559 NXDomain 0/1/0 (113)
12:34:56.134773 IP 183.16.171.56.5590 > public1.alidns.com.domain: 58650+ PTR? 5.5.5.223.in-addr.arpa. (40)
12:34:56.142499 IP public1.alidns.com.domain > 183.16.171.56.5590: 58650 1/0/0 PTR public1.alidns.com. (72)
12:34:56.150370 IP 183.16.171.56.49723 > 115.28.237.155.18886: UDP, length 54
12:34:56.200228 IP 115.28.237.155.18886 > 183.16.171.56.49723: UDP, length 73
12:34:56.252095 IP 183.14.110.72.54597 > 183.16.171.56.49723: UDP, length 64
12:34:56.262730 IP 183.14.110.72.54597 > 183.16.171.56.49723: UDP, length 64
12:34:56.270987 IP 183.14.110.72.54597 > 183.16.171.56.49723: UDP, length 64
12:34:56.329431 IP 183.16.171.56.49723 > 10.1.1.98.54597: UDP, length 60
12:34:56.329691 IP 183.16.171.56.49723 > 183.14.110.72.1024: UDP, length 63
12:34:56.329699 IP 183.16.171.56.1024 > 183.14.110.72.54597: UDP, length 64
12:34:56.329720 IP 183.16.171.56.1024 > 183.14.110.72.1033: UDP, length 63
12:34:56.339608 IP 183.16.171.56.49723 > 10.1.1.98.54597: UDP, length 60
12:34:56.339717 IP 183.16.171.56.49723 > 183.14.110.72.1024: UDP, length 63
12:34:56.339724 IP 183.16.171.56.1024 > 183.14.110.72.54597: UDP, length 64
12:34:56.339730 IP 183.16.171.56.1024 > 183.14.110.72.1033: UDP, length 63
12:34:56.349988 IP 183.16.171.56.1024 > 183.14.110.72.54597: UDP, length 64
12:34:56.350120 IP 183.16.171.56.1024 > 183.14.110.72.1033: UDP, length 63
12:34:56.350942 IP 183.16.171.56.49723 > 10.1.1.98.54597: UDP, length 60
12:34:56.350954 IP 183.16.171.56.49723 > 183.14.110.72.1024: UDP, length 63
12:34:56.410045 IP 183.14.110.72.54597 > 183.16.171.56.49723: UDP, length 64
12:34:56.421129 IP 183.14.110.72.54597 > 183.16.171.56.49723: UDP, length 64
12:34:56.430026 IP 183.14.110.72.54597 > 183.16.171.56.49723: UDP, length 64
12:34:57.144103 IP 183.16.171.56.48318 > public1.alidns.com.domain: 26683+ PTR? 155.237.28.115.in-addr.arpa. (45)
12:34:57.669772 IP public1.alidns.com.domain > 183.16.171.56.48318: 26683 NXDomain 0/0/0 (45)
12:34:57.670303 IP 183.16.171.56.11583 > public1.alidns.com.domain: 35238+ PTR? 72.110.14.183.in-addr.arpa. (44)
12:34:59.653906 IP public1.alidns.com.domain > 183.16.171.56.11583: 35238 NXDomain 0/1/0 (133)
12:35:01.058055 IP 183.14.110.72.54597 > 183.16.171.56.49723: UDP, length 64
12:35:01.067683 IP 183.14.110.72.54597 > 183.16.171.56.49723: UDP, length 64
12:35:01.078140 IP 183.14.110.72.54597 > 183.16.171.56.49723: UDP, length 64
12:35:01.150565 IP 183.16.171.56.1024 > 183.14.110.72.54597: UDP, length 64
12:35:01.150591 IP 183.16.171.56.1024 > 183.14.110.72.1033: UDP, length 63
12:35:01.150974 IP 183.16.171.56.49723 > 10.1.1.98.54597: UDP, length 60
12:35:01.150988 IP 183.16.171.56.49723 > 183.14.110.72.1024: UDP, length 63
12:35:01.160783 IP 183.16.171.56.49723 > 10.1.1.98.54597: UDP, length 60
12:35:01.160791 IP 183.16.171.56.1024 > 183.14.110.72.54597: UDP, length 64
12:35:01.160802 IP 183.16.171.56.49723 > 183.14.110.72.1024: UDP, length 63
12:35:01.160937 IP 183.16.171.56.1024 > 183.14.110.72.1033: UDP, length 63
12:35:01.171248 IP 183.16.171.56.49723 > 10.1.1.98.54597: UDP, length 60
12:35:01.171254 IP 183.16.171.56.1024 > 183.14.110.72.54597: UDP, length 64
12:35:01.171400 IP 183.16.171.56.49723 > 183.14.110.72.1024: UDP, length 63
12:35:01.171406 IP 183.16.171.56.1024 > 183.14.110.72.1033: UDP, length 63
12:35:06.056591 IP 183.14.110.72.54597 > 183.16.171.56.49723: UDP, length 64
12:35:06.067949 IP 183.14.110.72.54597 > 183.16.171.56.49723: UDP, length 64
12:35:06.078718 IP 183.14.110.72.54597 > 183.16.171.56.49723: UDP, length 64
12:35:06.150396 IP 183.16.171.56.1024 > 183.14.110.72.54597: UDP, length 64
12:35:06.150526 IP 183.16.171.56.1024 > 183.14.110.72.1033: UDP, length 63
12:35:06.150997 IP 183.16.171.56.49723 > 10.1.1.98.54597: UDP, length 60
12:35:06.151012 IP 183.16.171.56.49723 > 183.14.110.72.1024: UDP, length 63
12:35:06.160869 IP 183.16.171.56.49723 > 10.1.1.98.54597: UDP, length 60
12:35:06.160878 IP 183.16.171.56.1024 > 183.14.110.72.54597: UDP, length 64
12:35:06.160978 IP 183.16.171.56.1024 > 183.14.110.72.1033: UDP, length 63
12:35:06.160987 IP 183.16.171.56.49723 > 183.14.110.72.1024: UDP, length 63
12:35:06.171384 IP 183.16.171.56.49723 > 10.1.1.98.54597: UDP, length 60
12:35:06.171392 IP 183.16.171.56.1024 > 183.14.110.72.54597: UDP, length 64
12:35:06.171506 IP 183.16.171.56.1024 > 183.14.110.72.1033: UDP, length 63
12:35:06.171515 IP 183.16.171.56.49723 > 183.14.110.72.1024: UDP, length 63
12:35:14.304702 IP 70-90-56-174-westdade.fl.hfc.comcastbusiness.net.44066 > 183.16.171.56.53413: UDP, length 1
12:35:15.159994 IP 183.16.171.56.42944 > public1.alidns.com.domain: 18739+ PTR? 174.56.90.70.in-addr.arpa. (43)
12:35:17.343401 IP public1.alidns.com.domain > 183.16.171.56.42944: 18739 1/0/0 PTR 70-90-56-174-westdade.fl.hfc.comcastbusiness.net. (105)
12:35:39.670920 IP 183.16.171.56.35282 > 58.220.12.40.8000: UDP, length 54
12:35:39.731206 IP 58.220.12.40.8000 > 183.16.171.56.35282: UDP, length 36
12:35:41.062290 IP 183.16.171.56.44312 > 183.60.209.35.80: UDP, length 172
12:35:41.085499 IP 183.60.209.35.80 > 183.16.171.56.44312: UDP, length 28
12:35:41.368295 IP 183.16.171.56.50704 > public1.alidns.com.domain: 27972+ PTR? 35.209.60.183.in-addr.arpa. (44)
12:35:41.374908 IP public1.alidns.com.domain > 183.16.171.56.50704: 27972 NXDomain 0/1/0 (104)
12:35:41.447498 IP 183.16.171.56.57805 > 183.60.53.38.8000: UDP, length 91
12:35:41.475459 IP 183.60.53.38.8000 > 183.16.171.56.57805: UDP, length 211
12:35:42.376449 IP 183.16.171.56.16365 > public1.alidns.com.domain: 10301+ PTR? 38.53.60.183.in-addr.arpa. (43)
12:35:42.384424 IP public1.alidns.com.domain > 183.16.171.56.16365: 10301 NXDomain 0/1/0 (103)
12:35:45.084981 IP 183.16.171.56.30573 > public1.alidns.com.domain: 54232+ A? git.oschina.net. (33)
12:35:45.086387 IP 183.16.171.56.36608 > public1.alidns.com.domain: 56943+ AAAA? git.oschina.net. (33)
12:35:45.095001 IP public1.alidns.com.domain > 183.16.171.56.30573: 54232 4/0/0 CNAME safe.git.oschina.net., A 101.201.240.111, A 101.201.241.32, A 101.201.240.226 (100)
12:35:45.095455 IP public1.alidns.com.domain > 183.16.171.56.36608: 56943 1/1/0 CNAME safe.git.oschina.net. (123)
12:35:57.581099 IP 183.16.171.56.15990 > public1.alidns.com.domain: 32129+ A? janson.f3322.net. (34)
12:35:58.359025 IP public1.alidns.com.domain > 183.16.171.56.15990: 32129 1/0/0 A 183.16.171.56 (50)
12:35:59.548964 IP 183.16.171.56.50560 > 115.28.237.155.18886: UDP, length 54
12:35:59.600647 IP 115.28.237.155.18886 > 183.16.171.56.50560: UDP, length 73
12:35:59.659668 IP 183.14.110.72.58403 > 183.16.171.56.1024: UDP, length 63
12:35:59.659669 IP 183.14.110.72.58403 > 183.16.171.56.50560: UDP, length 64
12:35:59.659744 IP 183.14.110.72.58403 > 183.16.171.56.1033: UDP, length 63
12:35:59.669015 IP 183.14.110.72.58403 > 183.16.171.56.50560: UDP, length 64
12:35:59.669015 IP 183.14.110.72.58403 > 183.16.171.56.1024: UDP, length 63
12:35:59.669259 IP 183.14.110.72.58403 > 183.16.171.56.1033: UDP, length 63
12:35:59.680433 IP 183.14.110.72.58403 > 183.16.171.56.1024: UDP, length 63
12:35:59.680434 IP 183.14.110.72.58403 > 183.16.171.56.50560: UDP, length 64
12:35:59.680448 IP 183.14.110.72.58403 > 183.16.171.56.1033: UDP, length 63
12:35:59.738407 IP 183.16.171.56.50560 > 10.1.1.98.58403: UDP, length 60
12:35:59.738583 IP 183.16.171.56.1025 > 183.14.110.72.58403: UDP, length 64
12:35:59.738607 IP 183.16.171.56.1025 > 183.14.110.72.1024: UDP, length 63
12:35:59.738631 IP 183.16.171.56.1025 > 183.14.110.72.1033: UDP, length 63
12:35:59.748624 IP 183.16.171.56.50560 > 10.1.1.98.58403: UDP, length 60
12:35:59.748632 IP 183.16.171.56.1025 > 183.14.110.72.58403: UDP, length 64
12:35:59.748770 IP 183.16.171.56.1025 > 183.14.110.72.1024: UDP, length 63
12:35:59.748787 IP 183.16.171.56.1025 > 183.14.110.72.1033: UDP, length 63
12:35:59.758950 IP 183.16.171.56.1025 > 183.14.110.72.58403: UDP, length 64
12:35:59.758957 IP 183.16.171.56.50560 > 10.1.1.98.58403: UDP, length 60
12:35:59.759080 IP 183.16.171.56.1025 > 183.14.110.72.1024: UDP, length 63
12:35:59.759095 IP 183.16.171.56.1025 > 183.14.110.72.1033: UDP, length 63
12:35:59.827789 IP 183.14.110.72.58403 > 183.16.171.56.1024: UDP, length 63
12:35:59.827789 IP 183.14.110.72.58403 > 183.16.171.56.50560: UDP, length 64
12:35:59.827809 IP 183.14.110.72.58403 > 183.16.171.56.1033: UDP, length 63
12:35:59.838136 IP 183.14.110.72.58403 > 183.16.171.56.1024: UDP, length 63
12:35:59.838137 IP 183.14.110.72.58403 > 183.16.171.56.50560: UDP, length 64
12:35:59.838151 IP 183.14.110.72.58403 > 183.16.171.56.1033: UDP, length 63
12:35:59.848142 IP 183.14.110.72.58403 > 183.16.171.56.1024: UDP, length 63
12:35:59.848145 IP 183.14.110.72.58403 > 183.16.171.56.50560: UDP, length 64
12:35:59.848160 IP 183.14.110.72.58403 > 183.16.171.56.1033: UDP, length 63
12:36:03.187008 IP 183.16.171.56.48606 > public1.alidns.com.domain: 15669+ A? init.itunes.apple.com. (39)
12:36:03.233375 IP public1.alidns.com.domain > 183.16.171.56.48606: 15669 5/0/0 CNAME init-cdn.itunes-apple.com.akadns.net., CNAME init.itunes.apple.ccgslb.com.cn., CNAME apple.https.tel.ccgslb.com.cn., A 183.61.240.90, A 222.84.188.27 (196)
12:36:03.740878 IP 183.16.171.56.59792 > public1.alidns.com.domain: 20635+ A? www.apple.com. (31)
12:36:03.742442 IP 183.16.171.56.54757 > public1.alidns.com.domain: 60990+ A? p30-keyvalueservice.icloud.com. (48)
12:36:03.743908 IP 183.16.171.56.64320 > public1.alidns.com.domain: 17270+ A? apple.com. (27)
12:36:03.745466 IP 183.16.171.56.61521 > public1.alidns.com.domain: 60500+ A? www.qq.com. (28)
12:36:03.747846 IP public1.alidns.com.domain > 183.16.171.56.59792: 20635 4/0/0 CNAME www.apple.com.edgekey.net., CNAME www.apple.com.edgekey.net.globalredir.akadns.net., CNAME e6858.e19.s.tl88.net., A 119.145.144.223 (176)
12:36:03.752364 IP public1.alidns.com.domain > 183.16.171.56.64320: 17270 3/0/0 A 17.172.224.47, A 17.178.96.59, A 17.142.160.59 (75)
12:36:03.752378 IP public1.alidns.com.domain > 183.16.171.56.54757: 60990 2/0/0 CNAME p30-keyvalueservice-current.edge.icloud.apple-dns.net., A 17.248.154.143 (131)
12:36:03.752998 IP public1.alidns.com.domain > 183.16.171.56.61521: 60500 3/0/0 A 59.37.96.63, A 14.17.42.40, A 14.17.32.211 (76)
12:36:04.114308 IP 183.14.110.72.58403 > 183.16.171.56.1024: UDP, length 63
12:36:04.114309 IP 183.14.110.72.58403 > 183.16.171.56.50560: UDP, length 64
12:36:04.114355 IP 183.14.110.72.58403 > 183.16.171.56.1033: UDP, length 63
12:36:04.123298 IP 183.14.110.72.58403 > 183.16.171.56.1024: UDP, length 63
12:36:04.123299 IP 183.14.110.72.58403 > 183.16.171.56.50560: UDP, length 64
12:36:04.123345 IP 183.14.110.72.58403 > 183.16.171.56.1033: UDP, length 63
12:36:04.133648 IP 183.14.110.72.58403 > 183.16.171.56.1024: UDP, length 63
12:36:04.133648 IP 183.14.110.72.58403 > 183.16.171.56.50560: UDP, length 64
12:36:04.133664 IP 183.14.110.72.58403 > 183.16.171.56.1033: UDP, length 63
12:36:04.548949 IP 183.16.171.56.50560 > 10.1.1.98.58403: UDP, length 60
12:36:04.549084 IP 183.16.171.56.1025 > 183.14.110.72.58403: UDP, length 64
12:36:04.549100 IP 183.16.171.56.1025 > 183.14.110.72.1024: UDP, length 63
12:36:04.549114 IP 183.16.171.56.1025 > 183.14.110.72.1033: UDP, length 63
12:36:04.559218 IP 183.16.171.56.50560 > 10.1.1.98.58403: UDP, length 60
12:36:04.559227 IP 183.16.171.56.1025 > 183.14.110.72.58403: UDP, length 64
12:36:04.559238 IP 183.16.171.56.1025 > 183.14.110.72.1024: UDP, length 63
12:36:04.559349 IP 183.16.171.56.1025 > 183.14.110.72.1033: UDP, length 63
12:36:04.569625 IP 183.16.171.56.50560 > 10.1.1.98.58403: UDP, length 60
12:36:04.569632 IP 183.16.171.56.1025 > 183.14.110.72.58403: UDP, length 64
12:36:04.569781 IP 183.16.171.56.1025 > 183.14.110.72.1024: UDP, length 63
12:36:04.569795 IP 183.16.171.56.1025 > 183.14.110.72.1033: UDP, length 63
